,domain_name,Test_document,Expected_result,multinomial_model_3,multinomial_model_3_accuracy
356,trustleaf.com,financ financi servic person financ financ financi servic person financ trustleaf onlin platform enabl early-stag entrepreneur crowdfund ventur friend famili trustleaf onlin platform enabl early-stag entrepreneur crowdfund ventur friend famili small busi owner leverag social capit rais capit lender also get legal protect loan famili member??? word trustleaf offer featur auto-gener custom promissori note onlin signatur email remind updat repay quick loan builder trustleaf launch august 2013 anson liang daniel lieser base sunnyval california usa,Others,Others,72.6027397260274
108,mines.io,fintech mobil payment fintech mobil payment mines.io offer modern financi servic emerg market mines.io make state-of-the-art machin learn graph optim algorithm build financi model credit score fraud detect system integr bank platform payment api telecommun infrastructur provid seamless experi stakehold mines.io incorpor 2013 oper technolog industri headquart san francisco california,Credit rating platforms,Others,72.6027397260274
216,loan-street.com,bank content syndic financ bank content syndic financ loanstreet marketplac enabl effici syndic loan loan pool loanstreet new marketplac enabl effici syndic size loan loanstreet autom standard syndic origin matur enabl lender investor buy sell manag loan direct websit,Others,Others,72.6027397260274
160,spiderg.com,financi servic inform technolog mobil app financi servic inform technolog mobil app consult compani system need custom opensourc erp execut implement spiderg platform busi electron transact communic vendors/suppli custom get action inform busi suppli chain,Others,Others,72.6027397260274
245,lendstreet.com,credit financi servic fintech credit financi servic fintech lend street lend platform debt restructur refinanc lendstreet mission simpl help peopl get debt rebuild credit get fresh start partnership within financi sector allow negoti discount debt mean pass discount custom turn get debt sooner rebuild credit get live,Others,Others,72.6027397260274
252,collegeavestudentloans.com,credit financ financi servic fintech credit financ financi servic fintech colleg ave student loan product made firstrust bank member fdic colleg ave student loan offer privat student loan undergradu student graduat student parent student enter colleg special student loan abl provid custom attent deserv deliv loan person individu compani also facilit competit rate repay option customer-friend experi applic repay colleg ave student loan also offer borrow choic defer interest flat payment full princip interest payment,Education Loans ,Others,72.6027397260274
209,ondeck.com,credit financ financi servic small medium busi credit financ financi servic small medium busi ondeck technology-en financi platform provid loan financ small- medium-s busi ondeck technology-en financi platform provid loan financ small- medium-s busi compani use proprietari softwar aggreg data business??? oper process algorithm determin loan elig ondeck found 2006 base new york citi unit state,Others,Others,72.6027397260274
133,branch.co,app financi servic app financi servic branch new way access credit smartphon emerg market branch elimin challeng get loan use data phone creat credit score encrypt data choos share us protect privaci share inform third parti,Micro Finance ,Others,72.6027397260274
148,propellr.com,financi servic fintech real estat financi servic fintech real estat propellr provid institut famili offic individu w/direct access altern invest typic avail select propellr llc provid small institut famili offic accredit investor direct access altern invest opportun typic avail institut investor power user-friend interfac propellr curat high qualiti issuer suppli innov technolog market opportun direct investor launch 2013 todd lippiatt respect pillar new york real estat financ communiti wall street veteran propellr seek disrupt redefin antiqu construct industri grow team impass mind propellr process roll multipl innov altern asset class,Others,Others,72.6027397260274
72,splitit.com,credit financ financi servic credit financ financi servic splitit credit-bas payment system enabl merchant offer interest free month instal payment custom splitit??? patent technolog revolution retail world enabl seamless instal payment busi size type solut promot growth ecommerc well in-stor retail includ e-wallet capabl,Others,Others,72.6027397260274
101,lendedu.com,fintech real time fintech real time lendedu help consum compar person financ product lendedu.com onlin marketplac person financ product lendedu.com launch novemb 2014 marketplac student loan refinanc sinc compani expand product includ student loan person loan bank product insur product invest product auto loan credit card lendedu.com free servic consum,Others,Others,72.6027397260274
198,liftforward.com,"credit financi servic marketplac credit financi servic marketplac liftforward oper marketplac loan platform provid loan small busi liftforward oper marketplac loan platform provid loan small busi high yield debt product investor busi abl borrow 1,000,000 per transact asset purchas purchas order financ work capit liftforward partner supplier retail manufactur order provid financ small busi custom liftforward partnership includ co-brand white-label portal",Others,Others,72.6027397260274
60,visiolending.com,financ lend marketplac real estat real estat invest financ lend marketplac real estat real estat invest nation mortgag lender focus need experienc local expert residenti investor simpli put thrive real estat togeth parent compani econohom we???v bought sold financ 240 million home nationwid unlik lender know like skin game understand uniqu need residenti investor draw year experi distress properti field craft loan product four word mind fast simpl flexibl depend know real estat invest take certain amount initi spirit risk-tak it??? everyon we???r passion help peopl like achiev short-term long-term invest goal it??? reason start vfs four year ago oper 36 state continu grow success success,Mortgages,Others,72.6027397260274
285,autogravity.com,automot financ mobil automot financ mobil autogravity??? uniqu mobil platform deliv auto financ palm hand autograv fintech pioneer mission transform process financ car uniqu digit experi autograv partner world??? lead bank give consum direct control financ car smartphon offer simpl mobil platform autograv empow custom multipl loan offer network trust car dealerships.? headquart irvin ca autograv found team digit nativ industri veterans.? learn visit www.autogravity.com follow autogravityhq twitter,Auto Loans ,Others,72.6027397260274
83,dealstruck.com,financ financi servic local busi marketplac financ financi servic local busi marketplac dealstruck best place small busi financ growth dealstruck lend marketplac connect profit small- medium-s busi individu institut accredit investor unlik one-size-fits-al approach offer bank high-cost short-term credit offer altern lender dealstruck provid patient growth capit allow busi time plan execut maximum success dealstruck first combin thorough credit screen busi borrow allow investor freedom choos specif invest build custom portfolio meet prefer risk return industri size,Others,Others,72.6027397260274
40,yindou.com,financi servic impact invest financi servic impact invest yindou compani suppli chain financ invest area,Others,Others,72.6027397260274
329,microenergycredits.com,financi servic micro lend financi servic micro lend microenergi credit social enterpris provid consum develop countri clean energi product microenergi credit social enterpris provid consum develop countri clean energi product help microfin institut start clean energi lend program strengthen cloud-bas technolog last-mil servic scale carbon financ company??? product includ heat cook stove solar led light product solar home system water purif system clean household packag includ solar light effici stove water filter exact product specif packag vari local depend market research custom feedback given locat packag design local afford enough consum pay back microloan within 8 month microenergi credit co-found jame dailey https //www.crunchbase.com/person/james-dailey-2 april allderdic https //www.crunchbase.com/person/april-allderdic 2007 base seattl washington,Mortgages,Others,72.6027397260274
305,bankbazaar.com,bankbazaar world 's first neutral onlin marketplac instant customis rate quot loan credit card,Others,Others,72.6027397260274
286,qbera.com,financi servic financi servic qbera manag marketplac unsecur person loan qbera manag marketplac unsecur person loan leverag tech-en acquisit underwrit loan process capabl offer credit product co-creat bank part qbera 's multi-lend network origin asset bank??? liabil perform hybrid lend model wherein qbera share risk bank bank nbfcs plug balanc sheet qbera tap new custom segment use qbera??? programmat lend solut benefit lower oper expens data-driven underwrit credit decis reduct turnaround time cost custom acquisit proven technolog increas profit qbera capabl across lend lifecycl 1 acquisit omni-channel borrow sourc funnel tap best-in-class digit acquisit strategi tech-en offlin partner oper lending-as-a-servic laa model custom acquisit partner enabl offer credit product custom 2 underwrit valid risk strategi scorecard host sophist data-driven rule engin extend access credit salari employe 7 lakh compani 3 fulfil paper-less deliveri loan digit verif resid incom employ major borrow 4 servic proprietari loan manag system lms power custom relationship manag platform automated/self-servic along dedic contact center team 5 collect data-driven earli warn system track provid flexibl stress borrow remain financi buoyant,Others,Others,72.6027397260274
231,sparkfund.co,account analyt energi effici financ financi servic fintech account analyt energi effici financ financi servic fintech sparkfund power organ provid access latest energi technolog sparkfund financi technolog compani locat washington dc let busi pay time energi effici product servic sparkfund build softwar tool necessari sell product `` servic '' vendor increas want sell product `` servic '' mode sale ensur custom see simpl month payment lower financi benefit creat product complex ownership softwar analyt kept behind curtain drive signific growth sale,Others,Others,72.6027397260274
295,populous.co,financi servic lend financi servic lend popul invoic trade financ platform built use latest blockchain technolog popul invoic trade financ platform built use latest blockchain technolog popul use xbrl z score formula smart contract stabl token creat uniqu trade environ investor invoic seller around world read popul believ creat next generat fnancial marketplac,Others,Others,72.6027397260274
34,kashable.com,financi servic financi servic kashabl loan better borrow retir plan credit card mani lender take kashabl loan easi painless trip local bank branch storefront fill form mail stay hold repres phone complet entir process onlin within matter minut fund deposit electron bank account,Others,Others,72.6027397260274
41,lendlayer.com,big data financi servic fintech big data financi servic fintech financ futur educ financ student attend top acceler learn program,Education Loans ,Others,72.6027397260274
213,commloan.com,commerci real estat financi servic fintech commerci real estat financi servic fintech commloan??? passion technolog guarante alway match best possibl loan commloantm understand right loan critic bottom line commerci real estat project need loan option need fast hundr differ lender choos commloan bring one-stop shop unpreced access capit market,Others,Others,72.6027397260274
69,patchofland.com,crowdfund financ fintech internet lend real estat crowdfund financ fintech internet lend real estat pofland crowdfund solut real estat financ bring togeth borrow lender simpl onlin interfac patch land real estat marketplac lender use proprietari technolog data provid transpar scalabl effici lend solut patch land offer borrow access reliabl capit residenti commerci real estat project provid investor easi diversif real estat low minimum best-in-class secur loan structur,Others,Others,72.6027397260274
238,bluevine.com,financ fintech small medium busi financ fintech small medium busi bluevin allow small busi get paid immedi outstand invoic bluevin allow small busi get paid immedi outstand invoic bluevin compani free cash pay expens grow busi compani back lead ventur capit firm base redwood citi ca,Others,Others,72.6027397260274
194,kredx.com,fintech internet marketplac peer peer fintech internet marketplac peer peer kredx india 's first onlin invoic discount platform kredx indian invoic discount platform provid short-term invest opportun small- medium-s enterpris india onlin platform develop proprietari credit risk assess model borrow technolog platform financi provid complet trade servic sourc curat invoic conduct due dilig use proprietari credit underwrit algorithm launch manish kumar anurag jain puneet agarw 2015 kredx partner bank account firm law firm ensur aspect servic compliant regul ensur consum protect time,Others,Others,72.6027397260274
119,capzest.com,consum lend financi servic fintech consum lend financi servic fintech capzest digit lend platform focus unsecur financ incom generat purpos capzest digit lend platform focus provid unsecur credit individu incom generat purpos secur partnership incom generat servic platform provid short term capit various stakehold use in-hous tech platform autom entir loan disburs collect process proprietari credit engin instant calcul individual??? credit profil take consider 1000 data point,0,Others,72.6027397260274
304,ascentiumcapital.com,financi servic financi servic ascentium capit independ equip financ compani ascentium capit llc special provid broad rang financ leas work capit loan compani 's offer benefit equip manufactur distributor well direct busi nationwid,Others,Others,72.6027397260274
260,microf.com,consum financi servic fintech payment consum financi servic fintech payment microf??? first-to-market rto product provid unmatch flexibl consum microf relationship-bas compani give prioriti want need custom offer rental purchas financ option wide rang consum innov rent-to-own strategi provid flexibl consum limit declin quick respons time multipl payment option various contract term choic microf establish 2010 accommod grow demand flexibl option replac residenti heat cool system,Others,Others,72.6027397260274
281,realtyshares.com,"crowdfund financi servic real estat real estat invest crowdfund financi servic real estat real estat invest realtyshar onlin marketplac real estat invest realtyshar real estat crowdfund platform provid accredit investor access pre-vet real estat invest properti opportun invest littl 5,000 properti",Others,Others,72.6027397260274
296,vyze.com,consum lend custom servic financ financi servic fintech retail technolog ventur capit consum lend custom servic financ financi servic fintech retail technolog ventur capit vyze offer solut enabl retail offer payment option custom vyze financi technolog leader consum financ solut ncl help merchant launch implement innov lend program provid consum financ option want need ncl???s simpl solut deliv increas sale better consum financ experi give retail manufactur greater control lend option,Others,Others,72.6027397260274
264,moni.com.ar,"person financ person financ help receiv cash advanc immedi without formal paperwork 100 onlin hello 'm moni fanpag ask advanc 4,000 's simpl complet onlin form immedi confirm approv ll transfer within day bank account devolv?? like also easi day debitar?? agre bank account arriv end meet tight left trip friend unexpect want go mega concert help short term loan solv situat join www.moni.com.ar ll see easi",Others,Others,72.6027397260274
353,stacksource.com,commerci real estat fintech marketplac real estat commerci real estat fintech marketplac real estat onlin platform commerci real estat loan stacksourc new fintech platform 3t commerci mortgag market today 's loan origin process commerci real estat complet offlin fragment slow stacksourc 's platform help borrow mortgag broker connect lender onlin select negoti secur financ found team made ex-googl ex-facebook ex-northstar employe live prototyp close beta team finish techstar fintech acceler nyc 2016,Others,Others,72.6027397260274
313,crowdfundingalliantie.nl,internet internet larg number onlin crowdfund platform go want compani take advantag crowdfund larg number onlin crowdfund platform go want compani take advantag crowdfund cours arrang everyth good campaign much easier get market around crowdfund hand specialist lot knowledg experi,Others,Others,72.6027397260274
243,upstart.com,credit financ financi servic fintech internet lend person financ credit financ financi servic fintech internet lend person financ upstart fund platform mentor network match student backer believ potenti upstart goe beyond fico score offer person loan compani 's proprietari underwrit model identifi high-qual borrow despit limit credit employ histori use variabl includ school attend area studi academ perform work experi upstart offer 3-year 5-year fix interest loan primarili use pay credit card consolid debt elimin student debt start busi pay person develop bootcamp,Others,Others,72.6027397260274
38,achievelending.com,fintech fintech first-ev student loan comparison tool achievelend first-ev student loan comparison tool achievelending.com offer user free onlin portal search find compar student loan design help tradit non-tradit student find best student loan achiev lend first tool kind aggreg loan offer seek privat financ educ purpos take 30 second find choos best loan avail learn www.achievelending.com becom achiev lend affili commiss junction http //bit.ly/1ylqddi,Others,Others,72.6027397260274
287,selflender.com,fintech internet person financ fintech internet person financ self lender help peopl build credit simpl save plan self lender help thousand peopl begin financi journey credit builder account understand build financi foundat daunt task peopl re dedic build product help custom move two step right direct,Others,Others,72.6027397260274
346,shubhloans.com,financi servic inform technolog lend financi servic inform technolog lend shubhloan help financi servic provid access serv new underserv market segment datasign disrupt technolog compani forg idea use tradit non-tradit data comput peopl 's credit score aim democrat credit million borrow part formal credit system help financi servic provid access serv new underserv market segment deliv risk- as- -servic raa mobil platform shubh loan,Credit rating platforms,Others,72.6027397260274
254,icekredit.com,big data fintech machin learn big data fintech machin learn innov appli machin learn algorithm big data make all-round credit evalu individu smes icekredit inc. fintech compani regist shanghai free trade zone headquart locat lujiazui financi district branch nanj beij guangzhou changzhou chengdu los angel u.s.a. dedic innov appli machin learn algorithm big data relat technolog make all-round credit evalu individu smes icekredit found begin 2015 upon incept compani fund ten million yuan led intern renown ventur capit free capit yunqi partner wei lie capit decemb 2015 icekredit reciev angel fund octob 2016 icekredit obtain round fund present icekredit obtain total invest 160 million yuan product includ smes credit evalu system individu credit assess system consist anti-fraud engin person credit portrait miss custom contact inform restor compani establish busi relationship hundr domest oversea fin-tech tradit financi compani includ unionpay shenma financ neteas small loan taizhou bank fullerton credit subsidiari singapore-bas temasek hold icekredit??? founder- dr.gu lingyun expert appli big data technolog credit evalu individu smes founder head zestfin model team icekredit??? core member high competit background graduat univers chicago purdu univers georgia institut technolog georg washington univers new york univers carnegi mellon univers steven institut technolog etc return china held key posit benchmark fintech tradit financi compani kabbag zestfin lend club capit one discov ge capit barclay icekredit establish busi relationship hundr famous domest oversea fintech tradit financi compani cooper unionpay jieyu unit shenma financ taizhou bank neteas small loan fullerton credit wecash mani compani icekredit becom lead compani appli big data technolog individu sme credit evalu,Credit rating platforms,Others,72.6027397260274
110,loannow.com,consum lend financ financi servic fintech person financ consum lend financ financi servic fintech person financ mission help good peopl get better loan sinc launch 2013 loannow help peopl bring access transpar fair subprim lend industri time help borrow understand use credit build repay histori credit file incentiv good borrow behavior mission help good peopl get better loan,Others,Others,72.6027397260274
66,cancapital.com,commerci lend financ financi servic fintech commerci lend financ financi servic fintech capit provid capit small medium-s busi use real-tim platform risk-scor model capit provid capit small medium-s busi use real-tim platform risk-scor model daili remitt platform allow lender access daili cash flow borrow collect daili remitt platform give lender window customers??? daili busi reli payment processor split settlement card transact small busi bank capit inc. former known capit access network inc. chang name capit inc. decemb 2013 compani found 1998 base new york unit state,Others,Others,72.6027397260274
46,loanz.com,financ financi servic financ financi servic loanz privat credit platform marketplac lend upon loanz marketplac lend platform deliv ???loan service??? borrow investor rapid emerg disrupt lend financi servic industri internet platform connect borrow investor direct,Others,Others,72.6027397260274
214,indifi.com,busi intellig fintech transact process busi intellig fintech transact process lend product integr busi cash flow transact linkag segment lend product integr busi cash flow transact linkag segment,Others,Others,72.6027397260274
324,kountable.com,fintech fintech kountable??? mobil financ platform facilit global trade leverag busi social connect kountable??? mobil financ platform facilit global trade leverag busi social connect use app identifi empow qualiti entrepreneur small medium enterpris smes valid qualifi purchas order synchron overse logist provid trade financ mobil app disrupt complex global trade barrier bring account oversight entrepreneur servic govern univers hospit hotel manufactur ngos larg enterpris kountabl entrepreneur deliv fortun 1000 product develop nation emerg economi supplier histor burden logist financi local system constraint well gap global financi infrastructur kountable??? app creat kscore??? base user 's social media busi digit footprint kscore??? addit kyc protocol repres verifi busi transact inform custom communic pattern geograph locat deal valid kountable??? use data provid trade financ entrepreneur effect turn social capit financi capit,Others,Others,72.6027397260274
261,ibanonline.com,e-commerc fintech share economi e-commerc fintech share economi iban crowdlend financi compani aim deliv better deal saver borrow iban first global fintech guarante fund lend us allow support social project financi secur iban verg lead huge improv global crowdlend model aim deliv better deal saver borrow care money,Mortgages,Others,72.6027397260274
345,smyfinancial.com,financ financ new type internet fintech compani reli power fintech abil provid user inclus financ option samoy financi servic shenzhen samoy internet financi servic ltd. co new type internet fintech compani reli power fintech abil provid user inclus financ option samoy cut consum financ market mean first product `` sheng bei.??? sheng bei provid internet financi servic user credit card manag preferenti card-us guid lower interest rate compens balanc,Others,Others,72.6027397260274
115,purchasingpower.com,"e-commerc energi power grid e-commerc energi power grid found 2001 purchas power offer becom one countri 's premier purchas program employe found 2001 purchas power offer becom one countri 's premier purchas program employe atlanta-bas compani tap `` fastest-grow '' list sever lead busi public includ entrepreneur inc. magazin date purchas power servic 400,000 order employe lead compani organ across u.s. fortun 500 govern agenc",Others,Others,72.6027397260274
248,perfios.com,"financi servic fintech person financ financi servic fintech person financ perfio softwar solut pvt ltd. offer end user track monitor manag person financ littl manual intervent perfio person financ one stop ?? ? www.perfios.com newag fintech compani provid innov solut person financ relat area b2c person financ manag pfm solut provid perfio offer 360 degre view one??? person financ autom way let end user track monitor manag financ littl manual intervent alreadi 5,00,000 regist user deploy 6 year perfio leverag core technolog autom key aspect certain common busi process financi institut perfio insight b2b solut use various bank nbfcs corpor autom entir process financi check verif extract kyc detail current manual done perfio insight help dramat improv turn-around time process applic loan credit card insur etc whether origin offlin onlin channel thus delight prospect client result entir oper process improv result lower cost higher accuraci superior user experi result increas user acquisit process involv financi verif underwrit benefit use perfio solut perfio support 1000+ differ type e-stat 250+ financi institut automat fetch platform b2c b2b solut use various bank nbfcs corpor well end user b2c solut",Credit rating platforms,Others,72.6027397260274
