,domain_name,Test_document,Expected_result,multinomial_model_3,multinomial_model_3_accuracy
267,gopaysense.com,financi servic fintech inform technolog financi servic fintech inform technolog paysens fintech startup focus bring innov financi servic indian consum paysens fintech startup focus bring innov financi servic indian consum,Others,Others,72.6027397260274
51,biz2credit.com,"financi servic internet marketplac financi servic internet marketplac biz2credit hub connect small busi owner lender servic provid seek solut base onlin profil biz2credit www.biz2credit.com connect small busi owner lender servic provid thus empow effect compet big compani enhanc servic product grow enterpris biz2credit match small busi credit solut base onlin profil complet less five minut safe effici price-transpar environ biz2credit network consist 50,000 user 300 lender credit rate agenc equifax broker includ bizbuysel major small busi servic provid hp biz2credit top financ resourc entrepreneur magazin 2009 compani process 3,000 loan applic month facilit 400 million fund sinc 2007 registr free howev biz2credit also offer vari level subscript servic includ phone support case manag assist borrow entir lend process start initi applic form end day loan close biz2credit recent introduc free bizanalyzer??????? app android http //bit.ly/hlmwbl use inform credit rate agenc dun bradstreet bizanalyz provid free financi check-up small busi owner make loan applic process effici enabl borrow download review credit score tool benchmark risk assess small busi owner lend criteria 300 financi institut risk profil industri peer factor credit rate ultim impact credit decis lender biz2credit suggest best loan option possibl",Others,Others,72.6027397260274
310,cointribe.com,consum lend credit financ financi servic consum lend credit financ financi servic cointrib onlin lend marketplac provid small busi salari individu way get funds/capit cointrib oper onlin lend marketplac enabl small busi salari individu get fund capit company??? servic enabl compani appli busi person loan websit mobil applic cointrib found amit sachdev rohit lohia 2015 headquart gurgaon india,Others,Others,72.6027397260274
111,qredits.nl,credit financ financi servic credit financ financi servic qredit abl provid small loan dutch sme compani qredit helpt startend en bestaand ondernem bij het succesvol door starten van hun bedrijf dit doen door het aanbieden van ondernemerstool persoonlijk coach ??n het verstrekken van bedrijfskredieten tot ???250.000 on doel om dromen van ondernem mogelijk te maken vertrouwend op de kracht van het ondernemerschap de kracht van een go ide daarbij kijken wij liever naar de toekomst dan naar het verleden,Others,Others,72.6027397260274
186,finlocker.com,financi servic financi servic finlock consumer-en ???nancial locker reduc cost risk lender via action ???nancial inform finlock financi servic technolog innov found team season veteran lead execut across financi servic technolog industri time consum financi servic industri face heighten regulatori scrutini innov solut need ever finlock offer solut capabl improv loan process origin servic even beyond,Loan management platform,Others,72.6027397260274
299,getsimpl.com,fintech payment fintech payment simpl 's mission make money simpl peopl live well amaz thing simpl??? mission make money simpl peopl live well amaz thing simpl??? first product payment option let skip pay repeat instead pay later multipl order one go multipl verif payment failur fumbl chang order arriv,Others,Others,72.6027397260274
316,eflglobal.com,entrepreneuri financ lab help lender safe approv peopl entrepreneuri financ lab efl innov financial-technolog compani employ psychometr nontradit applic data creat credit score measur risk potenti among consum small busi efl??? altern score technolog enabl lender measur risk among applic information-scarc environ efl product earli harvard research recogn g-20 one innov approach sme financ global efl??? partner includ thirti retail mfi sme financi institut across dozen countri africa latin america south asia southeast asia inform pleas visit www.eflglobal.com,Credit rating platforms,Others,72.6027397260274
237,ablelending.com,"credit financ fintech small medium busi credit financ fintech small medium busi abl lowest-cost onlin lender small busi loan nation partner network provid loan 25k- 1mm abl lowest-cost onlin lender small busi nation passion fund busi stage new kind loan let borrow get capit lower rate recruit support friend famili fan averag able??? borrow save 31,000 loan 25,000 1,000,000 abl ???more loan.??? connect extraordinari entrepreneur addit capit communiti resourc expert advic it??? time grow learn nomin favorit busi get pre-approv 1 minut visit www.ablelending.com",Others,Others,72.6027397260274
200,numberz.in,financi servic financi servic numberz realis run busi sure commend task numberz realis run busi sure commend task mani time understand manag one critic resourc cash flow becom daunt excercis 's numberz endevour help number liter continu pursu dream,Others,Others,72.6027397260274
282,loantap.in,financi servic financi servic loantap fintech compani dna constitu loantap onlin platform commit deliv flexibl loan product salari profession innov otherwis dull loan segment deliv smart product millenni idea use technolog build flexibl product without ad cost,Working Capital ,Others,72.6027397260274
275,ziploan.in,financi servic lend small medium busi financi servic lend small medium busi ziploan onlin lend platform ziploan rbi regist nbfc technolog enabl on-lin lend platform establish provid small busi loan small busi loan segment ignor financi institut given granular peculiar small busi poor cost benefit trade-off respect sourc underwrit small loan,Others,Others,72.6027397260274
208,faircent.com,bank financi servic lend bank financi servic lend faircent.com websit borrow lender connect direct faircent help elimin high margin intermediari like bank financi institut make transact bank massiv overhead thousand employe pay hundr branch maintain bank must take larg margin money pass wherea faircent.com peopl spare money lend direct peopl want borrow bank middl huge overhead,Others,Others,72.6027397260274
6,thinkfinance.com,financ fintech lend person financ financ fintech lend person financ think financ provid lender abil rapid launch onlin loan product market-lead applic servic featur think financ power onlin lend 15+ year use lead technolog analyt risk market servic cortex platform provid lender abil rapid launch onlin loan product market-lead applic servic featur optim portfolio result cortex platform lender leverag secur technolog applic decis origin servic along option risk manag market oper servic,White label Platform,Others,72.6027397260274
191,affirm.com,consum lend financi servic fintech payment consum lend financi servic fintech payment affirm financi technolog servic compani offer instal loan consum point sale base san francisco california affirm financi servic compani offer instal loan consum point sale aim improv bank industri account access consum found 2012 affirm let shopper pay purchas across multipl month transpar fairly-pr fee built everi payment increas convers basket size e-tail less cost credit card,Others,Others,72.6027397260274
164,neogrowth.in,busi develop financ fintech market research busi develop financ fintech market research neogrowth credit pvt ltd non-deposit take nbfc regist rbi provid short term busi loan indian merchant neogrowth oper non-bank financi compani india focus meet financi need small busi sell good servic consum offer busi financ servic small- medium-s retail compani sell apparel consum durabl electron item footwear accessori handicraft gift food groceri item optic good well restaur beauti salon hotel gymnasium health diagnost center neogrowth began commerci oper 2013,Others,Others,72.6027397260274
240,redcarpetup.com,consum lend credit fintech mobil payment consum lend credit fintech mobil payment data driven onlin lend product purchas financ instal machin learn base credit score redcarpetup lend custom india bank see india credit financ compani abl servic less 10 custom base data widespread credit bureaus profil score custom redcarpet access much data includ data mobil phone use data servic custom never access credit today custom segment young future-prim student colleg use redcarpetup find credit fund onlin purchas ecommerc travel etc tomorrow hope unlock credit india,Others,Others,72.6027397260274
323,ioufinancial.com,iou financi focus provid small busi invest loan advisori servic fund 200 million small busi loan iou financi experi help busi get need offic world knowledg flexibl get busi capit need seiz growth opportun help realiz potenti,Others,Others,72.6027397260274
167,gyandhan.com,consum applic educ consum applic educ gyandhan educ loan marketplac gyandhan we???r mission ensur financi obstacl never stand way someone??? educ dream combin data scienc financi innov provid afford educ loan option indian student pursu higher studi,Education Loans ,Others,72.6027397260274
48,coderloan.co,colleg recruit educ financi servic web develop colleg recruit educ financi servic web develop connect busi talent talent fund educ chang way fund educ train hire move past job site agenc us coderloan connect talent aspir coder compani look junior develop re student profession look career chang program help find right train program busi hire manag platform make easi identifi candid skill educ best match junior posit,Education Loans ,Others,72.6027397260274
50,monexo.co,financi servic fintech marketplac peer peer financi servic fintech marketplac peer peer monexo onlin marketplac peer-to-p lend bring togeth lender borrow creat win-win monexo oper onlin peer-to-p lend marketplac small busi employe platform origin borrow lender onlin offlin sale market channel use proprietari screen system review borrow various financi non-financi paramet provid loan offer borrow agre loan offer list marketplac lender view fund allow borrow receiv 48 month futur rental incom subsequ assign rental incom lender launch 2014 monexo oper hong kong china,Others,Others,72.6027397260274
227,credible.com,consum lend credit financ consum lend credit financ credibl multi-lend marketplac allow borrow receiv competit loan offer vet lender credible??? found principl provid borrow level transpar deserv multi-lend marketplac allow borrow receiv competit loan offer vet lender credibl empow consum take control student loan borrow fill one form receiv compar person offer numer lender choos best serv individu need credibl fierc independ commit deliv fair unbias solut student lend,Education Loans ,Others,72.6027397260274
151,weidai.com.cn,financi servic lend payment financi servic lend payment china-bas p2p lend platform weidai earli stage person credit system base china peer-to-p lend servic use vehicl collater weidai plan expand use properti collater provid person loan well,Others,Others,72.6027397260274
126,financebuddha.com,financ financi servic fintech financ financi servic fintech financi servic product startup,Others,Others,72.6027397260274
176,clara.com,financi servic fintech person financ real estat financi servic fintech person financ real estat build fastest simplest way consum financ home clara combin advanc technolog dedic support simpl transpar home financ process clara special convent conform residenti home loan california offer follow product 30-year fix 25-year fix 20-year fix 15-year fix 7/1 arm 5/1 arm 3/1 arm offer purchas refin loan,Mortgages,Others,72.6027397260274
