,Test_document,Expected_result,multinomial_model_0,multinomial_model_0_accuracy
89,financ financ rateg onlin mortgag marketplac borrow bank set rate will pay home loan rateg lead mortgag marketplac mobil web user easili connect reput lender meet need negoti lowest possibl interest rate rateg bid platform,Mortgages,Others,78.37837837837837
203,crowdfund fintech real estat real estat invest crowdfund fintech real estat real estat invest peerstreet crowdfund platform give investor easi access high-yield loan collater real estat peerstreet lead platform invest real estat debt back andreessen horowitz found real estat attorney brew johnson former googl execut brett crosbi peerstreet allow investor easili invest high-yield real estat loan histor difficult access peerstreet secur intuit easy-to-us interfac particip deal simpl buy stock fund account select invest welcom peerstreet better deal everyon,Mortgages,Others,78.37837837837837
333,commerci lend financ financi servic lend commerci lend financ financi servic lend magilla search engin loan connect borrow bank without request person inform magilla loan search engin loan connect borrow bank without request person inform platform enabl borrow search compar loan without provid name social secur phone number loan propos present patent magchart??? allow borrow easili compar loan term choos lender magilla loan funnel 2b loan websit sinc launch septemb 2015 key featur fast loan propos typic deliv within hour anonym name social secur number phone number requir free borrow never pay fee safe credit check bank statement requir simpl answer question qualifi borrow receiv multipl loan propos authent receiv real loan propos lender autom lender time-sav quick loan submiss process save time,Mortgages,Others,78.37837837837837
334,financi servic micro lend financi servic micro lend microenergi credit social enterpris provid consum develop countri clean energi product microenergi credit social enterpris provid consum develop countri clean energi product help microfin institut start clean energi lend program strengthen cloud-bas technolog last-mil servic scale carbon financ company??? product includ heat cook stove solar led light product solar home system water purif system clean household packag includ solar light effici stove water filter exact product specif packag vari local depend market research custom feedback given locat packag design local afford enough consum pay back microloan within 8 month microenergi credit co-found jame dailey https //www.crunchbase.com/person/james-dailey-2 april allderdic https //www.crunchbase.com/person/april-allderdic 2007 base seattl washington,Mortgages,Others,78.37837837837837
11,analyt analyt daric peer-to-p lend platform provid person small busi loan daric peer peer lend platform extend person small busi loan competit rate use big data,Loan management platform,Others,78.37837837837837
134,analyt bank fintech softwar analyt bank fintech softwar consum credit analyt manag tool onlin creditseva.com onlin consum credit analyt manag tool help individu build healthi credit profil enabl user track report error instant communic bank credit bureaus get custom option build credit score also allow user settl old account rectifi error protect ident fraud set remind various financi transact creditseva.com launch 2011 base hyderabad india,Credit rating platforms,Others,78.37837837837837
317,financi servic financi servic credit sudhaar credit health manag compani review credit score individu help improv credit sudhaar onlin platform provid client credit advisori servic also offer financi product custom match users??? credit profil credit sudhaar provid client various credit financi tool free credit score credit score simul wide rang analyt assess help in-depth understand current credit status headquart mumbai maharashtra credit sudhaar offic bangalor kolkata found gaurav wadhwani arun ramamurthi 2010,Credit rating platforms,Others,78.37837837837837
139,consum lend fintech inform technolog consum lend fintech inform technolog bristlecon hold engin next generat financi technolog bristlecon develop technolog help busi evalu consum creditworthi autom approv algorithm look hundr differ custom data point leverag power machin learn issu immedi credit decis result truli person credit profil power tool help merchant grow busi,Credit rating platforms,Others,78.37837837837837
278,credit financ financi servic credit financ financi servic adf purpose-built optim link underestim underbank consum capit market adf purpose-built optim link underestim underbank consum capit market,Credit rating platforms,Others,78.37837837837837
100,credit financ financi servic credit financ financi servic altern credit bureau base atlanta factortrust altern credit bureau help lender manag credit lifecycl underbank consum use uniqu altern credit inform avail big three bureaus enabl offer non-prim consum credit deserv leverag company??? credit inform lender accur predict futur borrow behavior credit perform risk score grow segment factortrust??? team predict analyt specialist statistician financi industri expert deliv uniqu data valuabl insight lender throughout u.s. u.k. near ten year,Credit rating platforms,Others,78.37837837837837
42,big data financi servic fintech big data financi servic fintech financ futur educ financ student attend top acceler learn program,Education Loans ,Others,78.37837837837837
279,"financ higher educ financ higher educ mpower lend high-promis intern student top us univers mpower lend highly-employ domest intern student top us campus left tradit bank option loan either 3 10-year fix rate rang 2,000 25,000 mpower disburs payment direct univers behalf student pay tuition university-sponsor servic like hous meal plan health insur student start pay back loan within 6 month graduat loan come free person financ educ cours credit-build job placement servic student",Education Loans ,Others,78.37837837837837
171,consum applic educ consum applic educ gyandhan educ loan marketplac gyandhan we???r mission ensur financi obstacl never stand way someone??? educ dream combin data scienc financi innov provid afford educ loan option indian student pursu higher studi,Education Loans ,Others,78.37837837837837
172,educ lend educ lend fund u prefer no-cosign fafsa non-fico base student lender hardwork career focus colleg student fund univers fund univers privat student lender serv hardwork career driven undergradu parent lender depend fico score cosign fund univers assess student??? credit worthi base career track amp post-colleg earn potenti fund u take applic waitlist next school year fund expand avail lend student nationwid learn visit? www.funding-university.com visit funding-university.com,Education Loans ,Others,78.37837837837837
136,app financi servic app financi servic branch new way access credit smartphon emerg market branch elimin challeng get loan use data phone creat credit score encrypt data choos share us protect privaci share inform third parti,Micro Finance ,Others,78.37837837837837
