,Test_document,Expected_result,multinomial_model_0,multinomial_model_0_accuracy
233,financi servic financi servic tech-en consum lend platform organ around provid superior valu experi borrow name say provid person loan give custom lowest rate possibl perk end spend less give *borrowersfirst borrowersfirst.com borrowersfirst logo connectedcredit trademark borrowersfirst inc. delawar corpor,Others,Others,78.37837837837837
288,financ fintech lend financ fintech lend lendup social respons lender 56 american shut mainstream bank due low credit volatil incom lendup??? mission provid anyon path better financi health build technolog credit product educ experi 56 us popul shut mainstream bank poor credit volatil incom technolog built in-hous current offer sever type credit product includ loan credit card emb educ product avail credit build opportun help borrow improv long-term financi health break vicious debt cycl found two step-broth ceo sasha orloff cto jake rosenberg sasha put ???fin??? fintech work citi world bank grameen bank jake put ???tech??? fintech platform cto zynga 29 began work yahoo age 16 employe 80,Others,Others,78.37837837837837
64,financi servic financi servic even financi suppli side platform ssp marketplac lend base new york citi even financi suppli side platform fast grow marketplac lend p2p market initi mission bring better qualiti borrow marketplac lend ecosystem believ strong loan product everyon marketplac lend grow better data help lender see borrow credit score,Others,Others,78.37837837837837
53,crowdfund real estat crowdfund real estat real estat crowdfund brand hotel asset equityroot engag real estat crowdfund specif franchis hotel asset marriott hilton ihg starwood hyatt brand passiv investor find reward invest opportun asset class equityroots.com,Others,Others,78.37837837837837
246,rupi urban microfin offer loan entir mobil,Others,Others,78.37837837837837
20,e-commerc financi servic lend e-commerc financi servic lend smartbiz loan www.smartbizloans.com uniqu combin onlin sba loan marketplac bank enabl technolog platform smartbiz loan 1 onlin sba loan marketplac small busi loan intellig technolog platform make appli sba loan fast easi increas likelihood approv small busi match borrow sba prefer lend bank like fund particular busi 90 95 loan smartbiz refer bank partner get fund bank partner use smartbiz platform origin underwrit sba loan compliant manner also process loan 70 90 effici base financi district san francisco smartbiz loan privat held compani found 2009 team experienc financi servic entrepreneur back lead ventur capit firm includ investor growth capit venrock first round capit baselin ventur softtech vc,Others,Others,78.37837837837837
152,financi servic fintech real estat financi servic fintech real estat propellr provid institut famili offic individu w/direct access altern invest typic avail select propellr llc provid small institut famili offic accredit investor direct access altern invest opportun typic avail institut investor power user-friend interfac propellr curat high qualiti issuer suppli innov technolog market opportun direct investor launch 2013 todd lippiatt respect pillar new york real estat financ communiti wall street veteran propellr seek disrupt redefin antiqu construct industri grow team impass mind propellr process roll multipl innov altern asset class,Others,Others,78.37837837837837
37,crowdfund financ fintech crowdfund financ fintech earlyshar real estat crowdfund platform connect return-driven commerci real estat invest earlyshar crowdfund platform connect individu investor curat select vet return-driven real estat invest offer compliant platform investor gain direct access opportun growth compani real estat project invest fund investor either invest passiv owner equiti opportun brought forward sponsor loan origin institut lender earlyshar launch 2011 base miami florida,Others,Others,78.37837837837837
151,crowdfund fintech real estat real estat invest residenti crowdfund fintech real estat real estat invest residenti access real estat invest fund flip u.s.-bas technolog platform facilit financ residenti redevelop project provid basic screen due dilig redevelop project made avail platform accredit investor fund flip??? invest product borrow depend note allow platform pool investors??? capit togeth keep transact straightforward redevelop investor found 2014 fund flip use invest develop technolog expand platform help real estat develop provid new hous modern distress home,Others,Others,78.37837837837837
1,credit financ internet marketplac credit financ internet marketplac apnaloan onlin marketplac provid home loan person loan credit card custom india apnaloan onlin marketplac home loan person loan credit card india idea apnaloan bank compet loan turn mean get better rate compani say apnaloan `` largest onlin marketplac loan credit card '' http //www.dialabank.com/emi-calculator.cfm,Others,Others,78.37837837837837
3,financ financi servic ventur capit financ financi servic ventur capit bfs capit expert work capit need small busi deliv fund solut reason re busi they???r expert work capit need small busi headquart south florida technology-en financ platform provid 2 million small busi loan merchant cash advanc busi 50 state canada affili boost capit unit kingdom they???v deliv 1 billion total financ small- mid-siz busi across 400 industri help entrepreneur like access work capit busi need direct fund sourc industri leader sinc 2002 year experi firm financi back institut bank partner help solidifi posit prefer fund sourc small busi re proud track record success support dream thousand custom ?? ? 80 repeat busi result better busi bureau a+ rate,Others,Others,78.37837837837837
305,financi servic fintech small medium busi financi servic fintech small medium busi capit float onlin platform provid work capit financ smes india capit float onlin platform provid work capit financ smes india offer flexibl short-term loan use purchas inventori servic new order optim cash cycl borrow appli onlin minut select desir repay term receiv fund bank account 7 day minim hassl,Others,Others,78.37837837837837
284,financ financi servic fintech financ financi servic fintech west creek financi found help consum obtain financ purchas good west creek financi found help consum obtain financ purchas good servic want time help merchant servic supplier increas sale provid financ today??? tough econom time mani credit-worthi consum find increas hard get approv financ tradit bank financ compani tighten credit requir west creek??? founder deep lend expertis previous made signific credit risk improv largest us financi institut passion ensur custom store enabl get merchandis want,Others,Others,78.37837837837837
170,financi servic fintech mobil financi servic fintech mobil payjoy provid smartphone-en consum financ solut payjoy provid smartphone-en consum financ solut enabl custom purchas pay electron item time chang upfront purchas pay-as-you-go month instal company??? technolog lock devic unless month payment made improv custom payment rate offer financ solut smartphon wash machin tvs air condition bring middle-class lifestyl peopl around world compani found 2015 base saratoga california unit state,Others,Others,78.37837837837837
297,credit financ fintech internet credit financ fintech internet onlin marketplac lend compani that??? use technolog transform way china financ help enrich people??? live dianrong offer individu small medium-s enterpris comprehens one-stop financi platform support industry-lead technolog complianc transpar company??? sophist flexibl infrastructur enabl design custom lend borrow product servic base industry-specif data insight support onlin risk-manag oper tool,Others,Others,78.37837837837837
259,unlock home equiti wealth consum without interest month payment,Others,Others,78.37837837837837
224,fit health care well fit health care well letsmd.com marketplac elect surgeri letsmd hope chang way peopl access healthcar india price transpar healthcar price india black hole aim provid avenu prospect patient connect ethic healthcar servic provid offer transpar price found advis peopl decad experi healthcar letsmd aim go destin peopl seek high qualiti healthcar afford price,Others,Others,78.37837837837837
10,payment payment lendfriend offer softwar product provid support user loan??? creation propos approv repay lendfriend fintech startup focus undeserv lend market team built 3 product onlin p2p lend platform target friend famili grew 3mm+ loan multipl underwrit model util proprietari data tradit brick mortar high-interest lender identifi custom profil target larger loan lower interest rate loan repay disproport credit score onlin platform match high-risk borrow aggreg network onlin lender place loan prepaid card product 's purpos bank underbank lendfriend part ** angelpad http //angelpad.org 3** 2011,Others,Others,78.37837837837837
310,bankbazaar world 's first neutral onlin marketplac instant customis rate quot loan credit card,Others,Others,78.37837837837837
31,financ financ provid individu spare save opportun becom person lender screen profil borrow provid individu spare save opportun becom person lender screen profil borrow unlik peer peer platform platform financi inclus accept loan applic low credit score borrow borrow low credit score need obtain back high credit score person guarantor boost chanc obtain loan,Others,Others,78.37837837837837
329,fintech fintech kountable??? mobil financ platform facilit global trade leverag busi social connect kountable??? mobil financ platform facilit global trade leverag busi social connect use app identifi empow qualiti entrepreneur small medium enterpris smes valid qualifi purchas order synchron overse logist provid trade financ mobil app disrupt complex global trade barrier bring account oversight entrepreneur servic govern univers hospit hotel manufactur ngos larg enterpris kountabl entrepreneur deliv fortun 1000 product develop nation emerg economi supplier histor burden logist financi local system constraint well gap global financi infrastructur kountable??? app creat kscore??? base user 's social media busi digit footprint kscore??? addit kyc protocol repres verifi busi transact inform custom communic pattern geograph locat deal valid kountable??? use data provid trade financ entrepreneur effect turn social capit financi capit,Others,Others,78.37837837837837
360,financi servic financi servic trustio newdelhi-bas peer-to-p lend compani trustio person financi secur net trustio tri creat close alumni communiti member rais money alumni time need varieti reason invest money peer help well make decent return invest,Others,Others,78.37837837837837
355,financi servic lend financi servic lend mission snap advanc empow busi owner capit resourc guidanc need succeed snap advanc provid quick access work capit plus tool expert advic help go main street main attraction?? ? snap 90 small busi turn loan merchant becom strand without capit need grow busi unwil accept lack fund new status quo turn snap advanc partner snap advanc access work capit restor merchant cash advanc program program simpl pay advanc portion futur credit debit card transact custom pay advanc paid back small fix percentag daili transact,Others,Others,78.37837837837837
117,"consum financi servic point sale retail consum financi servic point sale retail loanhero provid financ import thing life empow merchant extend instant financ point sale loanhero provid financ import thing life whether it??? medic procedur cover insur new roof we???r cover expens 1,000 innov financ platform empow merchant extend instant financ point sale multipl lender simpl applic consum receiv best loan product regardless credit loanhero fastest grow player retail financ platform partner credit union creat better lend option consum hero join forc loanhero",Others,Others,78.37837837837837
41,financi servic impact invest financi servic impact invest yindou compani suppli chain financ invest area,Others,Others,78.37837837837837
188,consum lend credit financi servic consum lend credit financi servic greenski offer fast paperless solut financi servic busi size easi way offer financ everyon anywher easi busi size offer credit custom fast paperless solut,Others,Others,78.37837837837837
126,financi servic financi servic loanzen help small busi get unsecur work capit loan pend invoic loanzen help small busi get unsecur work capit loan pend invoic,Others,Others,78.37837837837837
267,commerci real estat marketplac real estat commerci real estat marketplac real estat money360 revolutionari onlin marketplac commerci real estat loan money360 revolutionari onlin marketplac commerci real estat loan money360 enabl borrow direct access afford commerci real estat loan innov onlin lend platform elimin overhead process cost associ tradit bank model loan fund bank insur compani pension fund accredit investor revolutionari onlin marketplac enabl borrow obtain competit rate flexibl term effici servic enabl investor receiv better return offer tradit invest vehicl,Others,Others,78.37837837837837
225,"agricultur farm financi servic agricultur farm financi servic nongfenqi rural internet financ servic platform nongfenqi rural internet financ servic platform.run nanj nongfenqi e-commerc co. ltd. provid instal payment servic larg farm group collabor commune agricultur equip purchas compani provid servic 20,000 client far report ad",Others,Others,78.37837837837837
39,fintech fintech first-ev student loan comparison tool achievelend first-ev student loan comparison tool achievelending.com offer user free onlin portal search find compar student loan design help tradit non-tradit student find best student loan achiev lend first tool kind aggreg loan offer seek privat financ educ purpos take 30 second find choos best loan avail learn www.achievelending.com becom achiev lend affili commiss junction http //bit.ly/1ylqddi,Others,Others,78.37837837837837
369,financ financ zestcash provid instal loan servic enabl custom take time need pay loan zestcash provid instal loan servic enabl custom take time need pay loan base palatin illinoi,Others,Others,78.37837837837837
328,iou financi focus provid small busi invest loan advisori servic fund 200 million small busi loan iou financi experi help busi get need offic world knowledg flexibl get busi capit need seiz growth opportun help realiz potenti,Others,Others,78.37837837837837
345,financ financ principi capit provid work capit small busi need help grant base credit score principi capit provid merchant cash advanc deal single-employe servic provid small medium-s busi base new york serv wide rang industri throughout entir unit state canada,Others,Others,78.37837837837837
50,internet softwar internet softwar data driven inventori financ hardwar compani kickpay transform hardwar compani financ inventori leverag client 's data kickpay enabl access financ previous unavail allow grow faster,Others,Others,78.37837837837837
339,nation??? lead financi servic firm connect merchant divers experienc privat busi lender,Others,Others,78.37837837837837
19,crowdfund lend marketplac crowdfund lend marketplac experienc team proven platform address need crowdfund marketplac south america experienc team proven platform address need crowdfund marketplac south america megatrend opportun team bet,Others,Others,78.37837837837837
311,"consum lend fintech lend marketplac consum lend fintech lend marketplac connect busi borrow lender base new york unit state boefli onlin marketplac leverag proprietari technolog transform way commerci transact conduct act onlin exchang connect parti involv transact therebi simplifi loan origin secondari market loan sale borrow build complet decision-readi loan request onlin use ???smartform??? technolog complet provid inform 3,600 lender nationwid match technolog identifi compat lender borrow complet control lender instant access loan request compani found 2008",Others,Others,78.37837837837837
193,health care health care help pharmacist obtain fund patient afford out-of-pocket pharmaceut expens medmonk base premis 's everyon 's best interest medic use regardless price patient get care medic need insur protect larger claim pharmaceut compani pharmaci get maximum use medic co-found somaira punjwani hiv specialti pharmacist invent process altern turn away patient struggl co-pay manual three year overwhelm posit feedback grate patient could afford medic,Others,Others,78.37837837837837
43,app big data mobil app big data mobil pier instant painless consum financ checkout us chines consum pier financi technolog compani focus develop technolog solut enabl custom transact mobil phone offer servic unit state china pier offer applic enabl custom access servic pier headquart san francisco offic shanghai china found richard jia juli 2014,Others,Others,78.37837837837837
358,commerci real estat fintech marketplac real estat commerci real estat fintech marketplac real estat onlin platform commerci real estat loan stacksourc new fintech platform 3t commerci mortgag market today 's loan origin process commerci real estat complet offlin fragment slow stacksourc 's platform help borrow mortgag broker connect lender onlin select negoti secur financ found team made ex-googl ex-facebook ex-northstar employe live prototyp close beta team finish techstar fintech acceler nyc 2016,Others,Others,78.37837837837837
251,financi servic financi servic time emi payment squar month bill make major purchas desir cash fin-tech product tslc pte ltd. uniqu young profession serv smart digit world cash offer millenni quick easi person loan process transpar innov tune time cash util sophist algorithm machin learn capabl deliv amaz improv lend experi custom therebi help young profession achiev financi goal effortless app offer instant transfer fund approv applic,Others,Others,78.37837837837837
149,automot financ peer peer automot financ peer peer ssinoconnect peer-to-p car financ platform connect potenti car buyer indonesia retail investor ssinoconnect oper peer-to-p car financ platform offer potenti car buyer smaller payment lower financ rate compani analyz credit risk recoveri provid credit model collater track fraud manag servic offer high recoveri invest potenti retail investor low payment custom look buy car ssinoconnect found darrel lee han yue lai heng koh henri lim ajinkya sadavart 2016 compani base singapor,Others,Others,78.37837837837837
205,financ fintech financ fintech itouzi offer websit enabl individu busi find invest inform financi product itouzi.com ????????? p2p financ servic websit base mortgag guarante itouzi attach invest financ beij network technolog co. ltd. built elit team work financi internet industri mani year internet financi websit itouzi.com provid individu safe transpar conveni high-return invest financ project compani loan project undergon strict offlin audit,Others,Others,78.37837837837837
175,financi servic financi servic onlin offlin customis financi servic solut busi lead financi product distributor india focus serv individu smes corpor customers.they decod financi jargon make thing simpl understand consumers.they larg distributor compel presenc onlin offlin focus provid custom accur inform best financi advic consequ appropri product relev need,Others,Others,78.37837837837837
30,"credit financ financi servic credit financ financi servic renrendai beijing-bas compani provid p2p financi servic loan debt invest other renrendai beijing-bas compani provid p2p platform financi servic loan debt invest other target white-collar employe small busi owner custom charg borrow manag fee 0.3 borrow money servic fee 5 high-risk borrow return renrendai.com loan 10 18 higher 3.25 offer one year turn deposit bank compani also control default risk measur borrow incom occup asset famili connect renrendai found may 2010 current servic network cover 2,000 region transact capit third quarter 2013 report us 81.2 million",Others,Others,78.37837837837837
214,financi servic financi servic rupaiya exchang peer-to-p lend platform rupaiya exchang lead peer peer p2p lend marketplac facilit lend connect creditworthi borrow lender across india,Others,Others,78.37837837837837
66,bank financi servic wealth manag bank financi servic wealth manag onlin access curat invest opportun growth-stag compani i-bank direct oper onlin equiti debt fund platform www.ibankers.com allow individu investor institut access proprietari invest opportun curat select privat public emerging-growth compani,Others,Others,78.37837837837837
56,e-commerc financi servic fintech internet retail e-commerc financi servic fintech internet retail aixuedai aixuedai onlin payment platform financ purchas consum electron made colleg student mainland china launch decemb 2012 allow student buy item phone tablet laptop camera use month instal plan custom need two photo id one student id appli loan find item want e-commerc site past url applic choos number month want pay money back option desir payment,Others,Others,78.37837837837837
59,consum lend debit card financi servic fintech consum lend debit card financi servic fintech oportun provid afford loan help peopl littl credit histori establish credit build better futur oportun use advanc data analyt technolog provid respons afford person loan peopl littl credit histori ?? ? peopl other consid ???unscoreable.??? sinc found 2005 oportun help million custom disburs 4 billion small dollar loan report account inform credit bureaus custom establish credit histori need compani oper 240+ retail locat deliv custom servic english spanish across channel includ mobil oportun loan current avail arizona california illinoi missouri nevada new mexico texa utah,Others,Others,78.37837837837837
277,crowdfund internet real estat crowdfund internet real estat exporo internet platform offer investor opportun invest real estat project crowdinvest exporo onlin platform offer real-est crowdfund servic user platform enabl user invest rang real-est project obtain return exporo launch 2014 base hamburg,Others,Others,78.37837837837837
292,fintech internet person financ fintech internet person financ self lender help peopl build credit simpl save plan self lender help thousand peopl begin financi journey credit builder account understand build financi foundat daunt task peopl re dedic build product help custom move two step right direct,Others,Others,78.37837837837837
286,"crowdfund financi servic real estat real estat invest crowdfund financi servic real estat real estat invest realtyshar onlin marketplac real estat invest realtyshar real estat crowdfund platform provid accredit investor access pre-vet real estat invest properti opportun invest littl 5,000 properti",Others,Others,78.37837837837837
322,expans capit group valu partner expans capit solut,Others,Others,78.37837837837837
69,financ fintech peer peer financ fintech peer peer ppdai onlin platform peer-to-p small unsecur loan china ppdai onlin platform peer-to-p small unsecur loan china build safe high-perform honest network platform creativ technolog ideal ppdai standard person behavior debit credit bring return lender borrow ppdai found august 2007 founder well known compani,Others,Others,78.37837837837837
294,asset manag financi servic lend asset manag financi servic lend iqianbang help make money onlin invest financi platform invest financi user loan user iqianbang help make money onlin invest financi platform invest financi user loan user end provid fair transpar safe effici network loan manag servic,Others,Others,78.37837837837837
263,"financi servic fintech financi servic fintech earlysalary.com new fintech start-up pune help broke earlysalari salari advanc mobil applic enabl indian user borrow money urgent cash requir get month wage aim help individu face month-end mid-month financi crisi provid small loan receiv salari user applic abl login though facebook account communic amount need loan date could settl submit basic document get money credit bank account earlysalari offer loan 1,000 inr 100,000 inr payback term rang 7 50 day",Others,Others,78.37837837837837
248,commerci lend credit financi servic small medium busi commerci lend credit financi servic small medium busi camino financi community-bas lender latino-own busi unmet credit demand 6.8 billion u.s. camino financi community-bas lender latino-own busi unmet credit demand 6.8 billion u. compani built loan product educ experi help busi improv financi perform graduat lower interest rate longer term loan,Others,Others,78.37837837837837
2,credit e-commerc payment credit e-commerc payment bill later paypal servic enabl custom purchas product without provid credit card detail bill later inc. provid payment market technolog solut multichannel retail offer paycaptur set credit tool bill later enabl custom pay purchas without provid credit card inform compani support deliv suit web-engin payment solut offer consult servic area payment risk manag market technolog bill later inc. former known i4 commerc inc. chang name bill later inc. august 2007 compani found 2000 base timonium maryland novemb 7 2008 bill later inc. oper subsidiari ebay inc,Others,Others,78.37837837837837
92,busi develop financi servic fintech lend marketplac busi develop financi servic fintech lend marketplac driverup first onlin auto lend marketplac accredit investor driverup onlin marketplac offer automot financ servic platform util proprietari technolog creat direct-to-investor option user integr softwar advanc data analyt marketplac enabl effici process direct invest auto loan full transpar report also first mechan offer accredit investor hedg fund famili offic high net-worth individu opportun particip direct high-yield auto lend launch 2012 marketplac oper dalla texa,Auto Loans ,Others,78.37837837837837
