,Test_document,Expected_result,multinomial_model_4,multinomial_model_4_accuracy
281,financi servic internet ventur capit financi servic internet ventur capit lendingkart onlin financ compani lendingkart onlin financ compani dedic help entrepreneur small busi work capit loan use analyt big data score evalu customer??? busi small motiv team banker data scientist techi tri make differ world small busi financ,Working Capital ,Others,48.64864864864865
253,big data financi servic fintech big data financi servic fintech wecash china-bas big data credit assess platform provid solut technolog compani wecash china-bas big data credit assess platform provid solut technolog compani use machine-learn algorithm provid credit assess less 15 minut mine public mobil data rough 600 million mobil internet user wecash abl quick provid extens credit assess build predict model customers??? credit risk,Others,Others,48.64864864864865
179,"financi servic financi servic fast afford onlin loan base equiti car finova financi social respons lender provid fast afford loan base equiti car 70 million financi underserv american spend 138 billion fee interest annual finova??? car equiti line credit c-loc cost 70 less current nation averag provid instant access capit 12-month pathway back financi health onlin mobil anywher 24/7 finova client benefit abil complet loan process onlin instant approv decis day cash fund finova client portal provid person access financi dashboard allow real time manag financi health payment made conveni comput mobil devic 32,000 us retail locat success payment histori provid declin rate opportun establish build credit along access addit fund demand finova provid immedi solut clients??? credit need abil monitor progress real time coupl finova??? ongo financi educ provid pathway improv econom health finova c-loc first mani digit financi servic product launch address unfulfil need financi underserv american finova busi relationship transact client tell us finova first posit relationship financi servic provid passion drive us forward",Personal loans,Personal loans,48.64864864864865
111,fintech mobil payment fintech mobil payment mines.io offer modern financi servic emerg market mines.io make state-of-the-art machin learn graph optim algorithm build financi model credit score fraud detect system integr bank platform payment api telecommun infrastructur provid seamless experi stakehold mines.io incorpor 2013 oper technolog industri headquart san francisco california,Others,Personal loans,48.64864864864865
317,financi servic financi servic credit sudhaar credit health manag compani review credit score individu help improv credit sudhaar onlin platform provid client credit advisori servic also offer financi product custom match users??? credit profil credit sudhaar provid client various credit financi tool free credit score credit score simul wide rang analyt assess help in-depth understand current credit status headquart mumbai maharashtra credit sudhaar offic bangalor kolkata found gaurav wadhwani arun ramamurthi 2010,Others,Personal loans,48.64864864864865
230,e-commerc financi servic fintech e-commerc financi servic fintech krazybe india-bas e-commerc web app enabl user order product onlin retail differ pay scheme conveni connect bridg colleg go youth india wonder dream aspir,Purchase Financing ,Personal loans,48.64864864864865
190,financi servic financi servic finlock consumer-en ???nancial locker reduc cost risk lender via action ???nancial inform finlock financi servic technolog innov found team season veteran lead execut across financi servic technolog industri time consum financi servic industri face heighten regulatori scrutini innov solut need ever finlock offer solut capabl improv loan process origin servic even beyond,Others,Personal loans,48.64864864864865
12,financ financ prome healthcar financ altern invest compani special medic practic healthcar busi prome healthcar financ former promac found 2007 headquart hauppaug ny prome healthcar financ first financ compani fund type electron payment proceed ach eft credit card receipt e-check process recur debit arc back offic convers,Term loans,Personal loans,48.64864864864865
99,financi servic fintech small medium busi financi servic fintech small medium busi ecg provid loan small busi u.s. histor underserv tradit financi institut expans capit group llc ???ecg??? provid loan small busi u.s. histor underserv tradit financi institut may experienc challeng obtain afford time financ compani develop technolog platform use predict model data aggreg electron payment technolog enabl servic target market tradit lender general focus small busi owners??? person credit histori ecg focus small busi owners??? person credit histori also perform small busi use broad array tradit nontradit data sourc compani develop proprietari end-to-end lend platform includ onlin base origin platform proprietari credit score model autom collect platform collect ach payment merchant,Working Capital ,Term loans,48.64864864864865
350,financ financ new type internet fintech compani reli power fintech abil provid user inclus financ option samoy financi servic shenzhen samoy internet financi servic ltd. co new type internet fintech compani reli power fintech abil provid user inclus financ option samoy cut consum financ market mean first product `` sheng bei.??? sheng bei provid internet financi servic user credit card manag preferenti card-us guid lower interest rate compens balanc,Personal loans,Personal loans,48.64864864864865
252,"financi servic fintech person financ financi servic fintech person financ perfio softwar solut pvt ltd. offer end user track monitor manag person financ littl manual intervent perfio person financ one stop ?? ? www.perfios.com newag fintech compani provid innov solut person financ relat area b2c person financ manag pfm solut provid perfio offer 360 degre view one??? person financ autom way let end user track monitor manag financ littl manual intervent alreadi 5,00,000 regist user deploy 6 year perfio leverag core technolog autom key aspect certain common busi process financi institut perfio insight b2b solut use various bank nbfcs corpor autom entir process financi check verif extract kyc detail current manual done perfio insight help dramat improv turn-around time process applic loan credit card insur etc whether origin offlin onlin channel thus delight prospect client result entir oper process improv result lower cost higher accuraci superior user experi result increas user acquisit process involv financi verif underwrit benefit use perfio solut perfio support 1000+ differ type e-stat 250+ financi institut automat fetch platform b2c b2b solut use various bank nbfcs corpor well end user b2c solut",Others,Personal loans,48.64864864864865
27,financ financi servic fintech micro lend non profit social entrepreneurship financ financi servic fintech micro lend non profit social entrepreneurship kiva zip communiti provid access 0 interest loan communiti passion help entrepreneur unit state base san francisco kiva intern non-profit organ enabl famili make small loan entrepreneur develop countri crowdfund 705 million u.s. dollar microloan one million entrepreneur 86 countri found 2005 kiva cover cost primarili option donat well support grant sponsor,Others,Others,48.64864864864865
165,fintech machin learn risk manag saa share economi fintech machin learn risk manag saa share economi trooli deliv instant trust??? servic verifi screen predict trustworthi relationship interact fintech p2p trooli deliv instant trust??? servic verifi screen predict trustworthi relationship interact work world??? largest financi institut peer-to-p marketplac market employ instant trust rate servic design fill ???trust gap??? caus speed modern commerc communiti requir instant evalu potenti reward risk ?? ? without trust-build interact histori feedback loop peopl use evalu relationship offlin machin learn technolog synthes digit footprint real time provid rich insight ?? ? well beyond old-school background check credit score risk manag tool instant trust rate requir minim custom data input cost less 1 per queri rate support evid return rough 30 second trooly??? predict power demonstr least twice effect background check credit check databas profil determin trustworthi individu busi trooli oper consum report agenc use public permiss inform onlin offlin sourc respect compli applic privaci data protect law includ fair credit report act unit state also dedic balanc transpar respect individu privaci,Others,Others,48.64864864864865
162,e-commerc servic industri shop e-commerc servic industri shop fenqil web-bas onlin shop mall offer wide rang product fenqil web-bas onlin shop mall offer wide rang product mobil phone person comput camera beauti product base shenzhen guangdong china,Purchase Financing ,Personal loans,48.64864864864865
46,financi servic fintech financi servic fintech first data-driven asset base lender offer financ solut small mid-siz manufactur supplier distributor credit junction first data-driven asset base lend platform transform way small mid-siz busi access work capit growth suppli chain financ solut compani combin technolog data intellig tradit asset-bas credit metric offer 5 million capit avail credit junction target growth-ori supplier distributor manufactur typic revenu 2m 25m financ compani provid help small busi access capit need also stimul job creation bolster communiti develop local town citi region across us canada,Working Capital ,Term loans,48.64864864864865
52,"financi servic internet marketplac financi servic internet marketplac biz2credit hub connect small busi owner lender servic provid seek solut base onlin profil biz2credit www.biz2credit.com connect small busi owner lender servic provid thus empow effect compet big compani enhanc servic product grow enterpris biz2credit match small busi credit solut base onlin profil complet less five minut safe effici price-transpar environ biz2credit network consist 50,000 user 300 lender credit rate agenc equifax broker includ bizbuysel major small busi servic provid hp biz2credit top financ resourc entrepreneur magazin 2009 compani process 3,000 loan applic month facilit 400 million fund sinc 2007 registr free howev biz2credit also offer vari level subscript servic includ phone support case manag assist borrow entir lend process start initi applic form end day loan close biz2credit recent introduc free bizanalyzer??????? app android http //bit.ly/hlmwbl use inform credit rate agenc dun bradstreet bizanalyz provid free financi check-up small busi owner make loan applic process effici enabl borrow download review credit score tool benchmark risk assess small busi owner lend criteria 300 financi institut risk profil industri peer factor credit rate ultim impact credit decis lender biz2credit suggest best loan option possibl",Lead generation platform,Personal loans,48.64864864864865
10,payment payment lendfriend offer softwar product provid support user loan??? creation propos approv repay lendfriend fintech startup focus undeserv lend market team built 3 product onlin p2p lend platform target friend famili grew 3mm+ loan multipl underwrit model util proprietari data tradit brick mortar high-interest lender identifi custom profil target larger loan lower interest rate loan repay disproport credit score onlin platform match high-risk borrow aggreg network onlin lender place loan prepaid card product 's purpos bank underbank lendfriend part ** angelpad http //angelpad.org 3** 2011,Personal loans,Personal loans,48.64864864864865
161,e-commerc financi servic payment e-commerc financi servic payment get lowest price leas option latest comput electron applianc furnitur flexshopp provid flexibl easi way get furnitur electron applianc popular brand name good low afford week payment goal get approv leas amount need take home product want dedic provid ultim custom servic experi us smooth begin end transact us confidenti secur relax get approv spend limit go shop enjoy,Purchase Financing ,Personal loans,48.64864864864865
23,financ saa softwar financ saa softwar instorefinance.com? offer softwar program allow retail store increas sale financ custom via onlin payment portal instor financ financ platform allow merchant financ custom purchas merchant use program longer lose big ticket sale custom n't money product ve care pick often happen custom n't qualifi tradit financ manag paperwork instal store cash check send month merchant work instor financ generat extra sale loyal custom sinc get tell `` re approv '',Purchase Financing ,Others,48.64864864864865
275,credit financi servic fintech lend credit financi servic fintech lend credi fintech platform connect borrow seek capit lender seek market beat return credi fintech platform connect borrow seek capit lender seek market-b return,Personal loans,Personal loans,48.64864864864865
287,financi servic financi servic loantap fintech compani dna constitu loantap onlin platform commit deliv flexibl loan product salari profession innov otherwis dull loan segment deliv smart product millenni idea use technolog build flexibl product without ad cost,Working Capital ,Personal loans,48.64864864864865
197,financi servic financi servic creditm fintech focus use vehicl financ india pos onlin credit distribut creditm fintech focus 8bn cagr 25 use motorcycl market india india world largest two wheeler market 40m new use bike sold day go market via network dealer enabl technolog allow dealer assess process loan insur point sale also oper direct consum websit enabl consum consum transact technolog credit engin mean abl process lend fast current lend 50 new credit 50 self employ borrow lend secur asset addit tech enabl optim collect success built full loan manag system allow lend partner quick effici integr grow team 30 peopl base mumbai india,Others,Personal loans,48.64864864864865
354,smartpay lease-to-own payment plan let??? custom shop devic accessori smartpay leas technology-driven compani work lead wireless retail prepaid phone compani provid innov devic leas solut nationwid use softwar data analyt solv hard problem underwrit consum minim credit histori consum get devic want today pay time easi schedul payment,Purchase Financing ,Personal loans,48.64864864864865
194,analyt big data biofuel clean energi geospati locat base servic solar analyt big data biofuel clean energi geospati locat base servic solar geostellar solar energi marketplac patent platform instant interact tailor equip financ instal geostellar appli big-data geomat comput precis renew resourc potenti infrastructur capac econom polici impact clean tech project subscript servic platform solar wind biofuel energi produc identifi optim site project market properti owner arrang financ coordin deploy support complex queri across everi rooftop field lot unit state,Others,Others,48.64864864864865
36,bank credit financi servic bank credit financi servic yooli network secur compani aim provid protect investor safeguard financi profession yooli cooper 23 offlin micro-credit compani offer investor access loan origin mani smaller p2p platform order build trust confid yooli partner third parti assess credit qualiti individu loan,Term loans,Personal loans,48.64864864864865
228,rental rental properti servic industri rental rental properti servic industri instal payment platform hous rent,Personal loans,Personal loans,48.64864864864865
84,financi servic fintech lend financi servic fintech lend marlett fund financi tech compani task empow custom marlett fund reinvent outdat slow confus financi product servic custom partner could n't happier,Personal loans,Personal loans,48.64864864864865
233,financi servic financi servic tech-en consum lend platform organ around provid superior valu experi borrow name say provid person loan give custom lowest rate possibl perk end spend less give *borrowersfirst borrowersfirst.com borrowersfirst logo connectedcredit trademark borrowersfirst inc. delawar corpor,Personal loans,Personal loans,48.64864864864865
94,consum lend financi servic fintech payment consum lend financi servic fintech payment kaixindai p2p lend platform kaixindai peer-to-p lend platform provid network invest financ servic client found 2012 compani base nanj jiangsu,Working Capital ,Personal loans,48.64864864864865
49,colleg recruit educ financi servic web develop colleg recruit educ financi servic web develop connect busi talent talent fund educ chang way fund educ train hire move past job site agenc us coderloan connect talent aspir coder compani look junior develop re student profession look career chang program help find right train program busi hire manag platform make easi identifi candid skill educ best match junior posit,Others,Others,48.64864864864865
247,credit financ financi servic fintech internet lend person financ credit financ financi servic fintech internet lend person financ upstart fund platform mentor network match student backer believ potenti upstart goe beyond fico score offer person loan compani 's proprietari underwrit model identifi high-qual borrow despit limit credit employ histori use variabl includ school attend area studi academ perform work experi upstart offer 3-year 5-year fix interest loan primarili use pay credit card consolid debt elimin student debt start busi pay person develop bootcamp,Personal loans,Personal loans,48.64864864864865
0,financ onlin auction small medium busi financ onlin auction small medium busi livecapit provid onlin small busi financ livecapit offer onlin busi financ servic offer user servic decisionexpress product creat econom benefit autom credit leas decis process integr workflow technolog consult solut enabl enterpris make credit decis improv product achiev sale provid credit custom livecapit u.s.-bas compani found 1996 compani acquir dun bradstreet credibl corpor juli 27 2005,Term loans,Term loans,48.64864864864865
64,financi servic financi servic even financi suppli side platform ssp marketplac lend base new york citi even financi suppli side platform fast grow marketplac lend p2p market initi mission bring better qualiti borrow marketplac lend ecosystem believ strong loan product everyon marketplac lend grow better data help lender see borrow credit score,Lead generation platform,Personal loans,48.64864864864865
95,bank credit financ bank credit financ balanc credit built thing don???t go accord plan balanc credit onlin lender provid famili individu person instal loan credit servic offer clear rate term toll-fre custom support abil pay earli penalti time balanc credit licens regul u.s. state oper found 2013 base irv texa,Personal loans,Personal loans,48.64864864864865
3,financ financi servic ventur capit financ financi servic ventur capit bfs capit expert work capit need small busi deliv fund solut reason re busi they???r expert work capit need small busi headquart south florida technology-en financ platform provid 2 million small busi loan merchant cash advanc busi 50 state canada affili boost capit unit kingdom they???v deliv 1 billion total financ small- mid-siz busi across 400 industri help entrepreneur like access work capit busi need direct fund sourc industri leader sinc 2002 year experi firm financi back institut bank partner help solidifi posit prefer fund sourc small busi re proud track record success support dream thousand custom ?? ? 80 repeat busi result better busi bureau a+ rate,Working Capital ,Term loans,48.64864864864865
332,real estat real estat loquid offer accredit intern investor curat local sourc real estat invest opportun loquid membership-bas platform offer accredit intern investor curat local sourc real estat invest opportun midwest marketplac crowd-sourc real estat invest take middlemen help sponsor fund project loquid member view pre-vet deal learn specif invest track progress onlin investor dashboard receiv email updat deal access q forum deal includ inform estim annual return project length invest properti locat inform market analysi profil primari parti involv invest loquid launch 2014 oper base michigan unit state,Term loans,Term loans,48.64864864864865
344,"fintech fintech plum transform cre ownership experi unparallel access loan option tech tool exclus network plum lend non-bank commerci real estat lender special loan 1,000,000 15,000,000 nationwid combin power innov technolog team real estat financ profession deliv expedit execut improv transact visibl unparallel client experi allow acquisit refin properti nationwid includ multifamili offic industri retail hotel manufactur hous self-storag plum lend u.s.-bas compani found 2014 bill fisher",Term loans,Term loans,48.64864864864865
368,ynera financi servic financi servic compani provid busi loan financ etc,Working Capital ,Personal loans,48.64864864864865
283,financ fintech financ fintech cignifi data monet startup develop analyt platform deliv credit market score use mobil behavior data cignifi revolution way financi servic compani meet need 2.7 billion peopl worldwid mobil phone access formal financi servic compani develop first proven analyt platform deliv credit market score consum use mobil phone behavior data,Others,Others,48.64864864864865
264,consum financi servic fintech payment consum financi servic fintech payment microf??? first-to-market rto product provid unmatch flexibl consum microf relationship-bas compani give prioriti want need custom offer rental purchas financ option wide rang consum innov rent-to-own strategi provid flexibl consum limit declin quick respons time multipl payment option various contract term choic microf establish 2010 accommod grow demand flexibl option replac residenti heat cool system,Purchase Financing ,Personal loans,48.64864864864865
6,financ fintech lend person financ financ fintech lend person financ think financ provid lender abil rapid launch onlin loan product market-lead applic servic featur think financ power onlin lend 15+ year use lead technolog analyt risk market servic cortex platform provid lender abil rapid launch onlin loan product market-lead applic servic featur optim portfolio result cortex platform lender leverag secur technolog applic decis origin servic along option risk manag market oper servic,Others,Personal loans,48.64864864864865
75,commerci real estat crowdfund real estat commerci real estat crowdfund real estat acquir real estat crowdfund platform accredit investor pre-fund co-invest sole institutional-qu deal acquir real estat lead real estat crowdfund platform one platform pre-fund deal acquir focus cash-flow institutional-qu real estat deal co-invest everi properti right alongsid member learn www.acquirerealestate.com,Term loans,Term loans,48.64864864864865
219,credit financi servic fintech credit financi servic fintech mortgag get whole lot easier hi re maxwel we???r mission revolution 8.5t residenti mortgag market reimagin loan offic work togeth homebuy real estat agent buy home connect network one seamless intuitively-design platform focus isn???t paperwork it??? place call home,Lead generation platform,Others,48.64864864864865
360,financi servic financi servic trustio newdelhi-bas peer-to-p lend compani trustio person financi secur net trustio tri creat close alumni communiti member rais money alumni time need varieti reason invest money peer help well make decent return invest,Personal loans,Personal loans,48.64864864864865
361,financ financi servic person financ financ financi servic person financ trustleaf onlin platform enabl early-stag entrepreneur crowdfund ventur friend famili trustleaf onlin platform enabl early-stag entrepreneur crowdfund ventur friend famili small busi owner leverag social capit rais capit lender also get legal protect loan famili member??? word trustleaf offer featur auto-gener custom promissori note onlin signatur email remind updat repay quick loan builder trustleaf launch august 2013 anson liang daniel lieser base sunnyval california usa,Term loans,Term loans,48.64864864864865
334,financi servic micro lend financi servic micro lend microenergi credit social enterpris provid consum develop countri clean energi product microenergi credit social enterpris provid consum develop countri clean energi product help microfin institut start clean energi lend program strengthen cloud-bas technolog last-mil servic scale carbon financ company??? product includ heat cook stove solar led light product solar home system water purif system clean household packag includ solar light effici stove water filter exact product specif packag vari local depend market research custom feedback given locat packag design local afford enough consum pay back microloan within 8 month microenergi credit co-found jame dailey https //www.crunchbase.com/person/james-dailey-2 april allderdic https //www.crunchbase.com/person/april-allderdic 2007 base seattl washington,Others,Others,48.64864864864865
279,"financ higher educ financ higher educ mpower lend high-promis intern student top us univers mpower lend highly-employ domest intern student top us campus left tradit bank option loan either 3 10-year fix rate rang 2,000 25,000 mpower disburs payment direct univers behalf student pay tuition university-sponsor servic like hous meal plan health insur student start pay back loan within 6 month graduat loan come free person financ educ cours credit-build job placement servic student",Others,Others,48.64864864864865
188,consum lend credit financi servic consum lend credit financi servic greenski offer fast paperless solut financi servic busi size easi way offer financ everyon anywher easi busi size offer credit custom fast paperless solut,Purchase Financing ,Personal loans,48.64864864864865
