,Test_document,Expected_result,multinomial_model_4,multinomial_model_4_accuracy
235,account analyt energi effici financ financi servic fintech account analyt energi effici financ financi servic fintech sparkfund power organ provid access latest energi technolog sparkfund financi technolog compani locat washington dc let busi pay time energi effici product servic sparkfund build softwar tool necessari sell product `` servic '' vendor increas want sell product `` servic '' mode sale ensur custom see simpl month payment lower financi benefit creat product complex ownership softwar analyt kept behind curtain drive signific growth sale,Term loans,Others,48.64864864864865
236,"financ financi servic lend financ financi servic lend re make mortgag fast simpl total better better re make get mortgag fast simpl total better offic nyc re revolution 13 trillion industri american pay hous almost els combin ?? ? 33 person consumpt expenditur yet somehow mortgag process still take near 50 day cost 5,000 administr fee requir 225 page paper endless phone call commiss loan broker think insan ?? ? we???r fix team combin lead technologist compani like spotifi googl mortgag bank three generat experi togeth we???r use data scienc machin learn ux design make mortgag experi ?? ? enjoy excit part biggest transact americans??? live",Others,Others,48.64864864864865
126,financi servic financi servic loanzen help small busi get unsecur work capit loan pend invoic loanzen help small busi get unsecur work capit loan pend invoic,Working Capital ,Working Capital ,48.64864864864865
169,e-commerc financi servic payment e-commerc financi servic payment credit key patent pay-over-tim financ solut e-commerc merchant credit key patent pay-over-tim financ solut e-commerc merchant,Purchase Financing ,Personal loans,48.64864864864865
218,busi intellig fintech transact process busi intellig fintech transact process lend product integr busi cash flow transact linkag segment lend product integr busi cash flow transact linkag segment,Working Capital ,Personal loans,48.64864864864865
144,develop platform e-commerc financ fintech develop platform e-commerc financ fintech licaifan chines onlin financ platform licaifan chines onlin financ platform offer p2b invest loan financi servic small- medium-s enterpris launch march 2014 compani headquart beij china,Term loans,Term loans,48.64864864864865
158,custom servic onlin portal payment custom servic onlin portal payment buy pay later solut india epaylat found decemb 2015 aurko bhattacharya prasannaa murlidharan uday somayajula shanmunathan thiagaraja saxena compani give custom option ???buy pay later??? onlin portal one click custom get 14 day make payment within period make mani transact via single-click checkout bunch togeth make singl payment end period,Purchase Financing ,Personal loans,48.64864864864865
296,consum lend financi servic fintech consum lend financi servic fintech bread partner retail offer pay-over-tim solut make financ easier transpar bread partner retail offer pay-over-tim solut make financ easier transpar use technolog advanc consumer-friend credit improv access transpar ease-of-us cost product help merchant partner grow sale make product access consum bread found 2014 base new york ny,Purchase Financing ,Personal loans,48.64864864864865
154,crowdfund financ financi servic crowdfund financ financi servic i2ifund onlin marketplac connect borrow look person loan investor look altern invest i2i peer-to-p p2p marketplac connect borrow lender unsecur loan use gamut reason like purchas consum durabl debt consolid i.e repay credit card debt etc medic expens educ expens cash cycl optim etc entir credit process transpar quick easi apart provid end end servic i2i dilig use unconvent data point borrow like educ employ transact salari social network etc sole depend cibil score lend recommend help investor greater understand borrow 's riski lead better credit decis,Personal loans,Personal loans,48.64864864864865
127,financi servic financi servic cashbus microfin compani cashbus microfin compani establish 2014 headquart shanghai offer small short-term micro instal loan underbank china,Personal loans,Personal loans,48.64864864864865
220,bank content syndic financ bank content syndic financ loanstreet marketplac enabl effici syndic loan loan pool loanstreet new marketplac enabl effici syndic size loan loanstreet autom standard syndic origin matur enabl lender investor buy sell manag loan direct websit,Lead generation platform,Term loans,48.64864864864865
42,big data financi servic fintech big data financi servic fintech financ futur educ financ student attend top acceler learn program,Others,Others,48.64864864864865
134,analyt bank fintech softwar analyt bank fintech softwar consum credit analyt manag tool onlin creditseva.com onlin consum credit analyt manag tool help individu build healthi credit profil enabl user track report error instant communic bank credit bureaus get custom option build credit score also allow user settl old account rectifi error protect ident fraud set remind various financi transact creditseva.com launch 2011 base hyderabad india,Others,Others,48.64864864864865
202,"credit financi servic marketplac credit financi servic marketplac liftforward oper marketplac loan platform provid loan small busi liftforward oper marketplac loan platform provid loan small busi high yield debt product investor busi abl borrow 1,000,000 per transact asset purchas purchas order financ work capit liftforward partner supplier retail manufactur order provid financ small busi custom liftforward partnership includ co-brand white-label portal",Term loans,Term loans,48.64864864864865
339,nation??? lead financi servic firm connect merchant divers experienc privat busi lender,Term loans,Term loans,48.64864864864865
335,financ financi servic micro lend social entrepreneurship financ financi servic micro lend social entrepreneurship build model relat small sum money enabl thousand peopl move away econom enabl rural individu obtain small loan educ farm busi urban profession certain type busi entrepreneur obtain fund form profit-shar invest rather loan,Others,Others,48.64864864864865
174,educ financ financi servic internet educ financ financi servic internet commonbond onlin lend platform connect borrow investor make educ financ better commonbond found lower cost higher educ innov model make possibl student save money student loan allow investor earn competit financi return,Others,Personal loans,48.64864864864865
89,financ financ rateg onlin mortgag marketplac borrow bank set rate will pay home loan rateg lead mortgag marketplac mobil web user easili connect reput lender meet need negoti lowest possibl interest rate rateg bid platform,Others,Personal loans,48.64864864864865
104,financ real estat financ real estat lenda onlin platform enabl individu refin home loan onlin lenda former gorefi onlin platform enabl individu refin home loan onlin user get real time quot submit applic verifi upload document close loan lenda found jason van den brand elijah murray 2011,Others,Term loans,48.64864864864865
31,financ financ provid individu spare save opportun becom person lender screen profil borrow provid individu spare save opportun becom person lender screen profil borrow unlik peer peer platform platform financi inclus accept loan applic low credit score borrow borrow low credit score need obtain back high credit score person guarantor boost chanc obtain loan,Personal loans,Personal loans,48.64864864864865
113,consum lend financ financi servic fintech person financ consum lend financ financi servic fintech person financ mission help good peopl get better loan sinc launch 2013 loannow help peopl bring access transpar fair subprim lend industri time help borrow understand use credit build repay histori credit file incentiv good borrow behavior mission help good peopl get better loan,Personal loans,Personal loans,48.64864864864865
299,clean energi financ fintech renew energi clean energi financ fintech renew energi renew financi found 2008 cisco devri origin idea properti assess clean energi pace financ model renew financi provid financ solut help effici renew energi contractor grow busi promot energi independ aim develop advanc financ design transform america??? economi clean energi company??? financ product includ pace financ model warehous energi effici loan open residenti energi effici financ market larg institut investor found 2008 cisco devri renew financi partnership solarc target small- medium-s busi util pace,Others,Others,48.64864864864865
304,fintech payment fintech payment simpl 's mission make money simpl peopl live well amaz thing simpl??? mission make money simpl peopl live well amaz thing simpl??? first product payment option let skip pay repeat instead pay later multipl order one go multipl verif payment failur fumbl chang order arriv,Purchase Financing ,Personal loans,48.64864864864865
231,consum lend credit financ consum lend credit financ credibl multi-lend marketplac allow borrow receiv competit loan offer vet lender credible??? found principl provid borrow level transpar deserv multi-lend marketplac allow borrow receiv competit loan offer vet lender credibl empow consum take control student loan borrow fill one form receiv compar person offer numer lender choos best serv individu need credibl fierc independ commit deliv fair unbias solut student lend,Others,Personal loans,48.64864864864865
340,energi renew energi energi renew energi open energi provid 0.5m 10m non-recours debt financ solar project open energi provid 0.5m 10m non-recours debt financ solar project standard document fix transact cost streamlin financ process open energi rapid process loan applic allow quick tap potenti solar power compar tradit lender open energy??? solut reduc total transact fee approxim 70 percent,Term loans,Others,48.64864864864865
346,"lend softwar lend softwar quiklo micro-lend platform student enabl electron purchas emi quiklo build proprietari next generat credit risk engin use 1,000+ data point includ deriv data build robust underwrit manag strategi data point deriv multipl non-tradit altern data sourc cater segment credit histori cibil score believ segment equal aspir credit worthi one cibil score core technolog determin credit worthi borrow among young milleni",Purchase Financing ,Others,48.64864864864865
