,Test_document,Expected_result,decision_model_6,decision_model_6_accuracy
20,e-commerc financi servic lend e-commerc financi servic lend smartbiz loan www.smartbizloans.com uniqu combin onlin sba loan marketplac bank enabl technolog platform smartbiz loan 1 onlin sba loan marketplac small busi loan intellig technolog platform make appli sba loan fast easi increas likelihood approv small busi match borrow sba prefer lend bank like fund particular busi 90 95 loan smartbiz refer bank partner get fund bank partner use smartbiz platform origin underwrit sba loan compliant manner also process loan 70 90 effici base financi district san francisco smartbiz loan privat held compani found 2009 team experienc financi servic entrepreneur back lead ventur capit firm includ investor growth capit venrock first round capit baselin ventur softtech vc,Term loans,Working Capital ,37.3134328358209
217,commerci real estat financi servic fintech commerci real estat financi servic fintech commloan??? passion technolog guarante alway match best possibl loan commloantm understand right loan critic bottom line commerci real estat project need loan option need fast hundr differ lender choos commloan bring one-stop shop unpreced access capit market,Term loans,Term loans,37.3134328358209
234,financi servic financi servic currenc capit equip financ lend technolog invest compani heel great recess busi around countri found left behind commerci bank weren???t lend delay applic fund far long group financi expert along tech wizard decid take action engin technolog streamlin approv fund get complet financi pictur begin applic process result currenc sinc we???v help support busi 500 million loan,Term loans,Working Capital ,37.3134328358209
86,crowdfund small medium busi crowdfund small medium busi mission lead communiti capit transform mission lead communiti capit transform investnextdoor creat first community-engag capit marketplac marketplac creat new sourc reason price capit small busi better return main street investor longev community-bas bank credit union focus communiti first amplifi econom effect consum invest small busi keep benefit borrow lifecycl within given communiti educ access transpar fair core valu start investnextdoor believ us borrow invest model broken ve hit reset button start fresh go back basic ve made better ve made social fun impact re brand new kind financi servic compani ve alreadi made thing better,Term loans,Others,37.3134328358209
267,commerci real estat marketplac real estat commerci real estat marketplac real estat money360 revolutionari onlin marketplac commerci real estat loan money360 revolutionari onlin marketplac commerci real estat loan money360 enabl borrow direct access afford commerci real estat loan innov onlin lend platform elimin overhead process cost associ tradit bank model loan fund bank insur compani pension fund accredit investor revolutionari onlin marketplac enabl borrow obtain competit rate flexibl term effici servic enabl investor receiv better return offer tradit invest vehicl,Term loans,Term loans,37.3134328358209
30,"credit financ financi servic credit financ financi servic renrendai beijing-bas compani provid p2p financi servic loan debt invest other renrendai beijing-bas compani provid p2p platform financi servic loan debt invest other target white-collar employe small busi owner custom charg borrow manag fee 0.3 borrow money servic fee 5 high-risk borrow return renrendai.com loan 10 18 higher 3.25 offer one year turn deposit bank compani also control default risk measur borrow incom occup asset famili connect renrendai found may 2010 current servic network cover 2,000 region transact capit third quarter 2013 report us 81.2 million",Term loans,Lead generation platform,37.3134328358209
148,crowdfund energi financ solar crowdfund energi financ solar sunfund crowdfund platform connect investor high-impact solar project off-grid communiti around world sunfund new crowdfund platform anyon invest high-impact solar project unlock access clean afford energi around world sunfund solv biggest problem face solar busi work deploy afford solar technolog off-grid market access financ sunfund unlock big new sourc capit solar individu investor abl profit invest high qualiti vet project facilit low-cost financ solar busi fund project,Term loans,Term loans,37.3134328358209
241,"credit financ fintech small medium busi credit financ fintech small medium busi abl lowest-cost onlin lender small busi loan nation partner network provid loan 25k- 1mm abl lowest-cost onlin lender small busi nation passion fund busi stage new kind loan let borrow get capit lower rate recruit support friend famili fan averag able??? borrow save 31,000 loan 25,000 1,000,000 abl ???more loan.??? connect extraordinari entrepreneur addit capit communiti resourc expert advic it??? time grow learn nomin favorit busi get pre-approv 1 minut visit www.ablelending.com",Term loans,Working Capital ,37.3134328358209
206,financi servic marketplac real estat financi servic marketplac real estat lendinghom offer flexibl simpl fast transpar reliabl way borrow get mortgag `` silicon valley reimagin mortgag process ground right way '' ask question late 2013 realiz mortgag broken hard believ industri massiv vital import economi could continu function virtual innov decid fix lendinghom born brought togeth best technolog oper data build next generat mortgag platform meant rethink custom acquisit user experi credit analysi algorithm underwrit oper effici loan servic capit market financi autom consum brand fundament believ technology-en marketplac bring togeth borrow investor futur mortgag combin platform world-class entrepreneuri team ve made futur realiti welcom lendinghom,Term loans,Others,37.3134328358209
183,financ fintech lend financ fintech lend fundat onlin direct lender offer simpl interest small busi loan compani technolog driven process bank offer busi loan fundat offer busi loan faster fundat altern lender provid small busi loan fix rate simpl interest technolog streamlin small busi loan applic process collect third parti data autom major credit review process deliv fund quick possibl leader altern busi financ understand everi busi uniqu specif need fundation??? custom small busi loan ensur receiv appropri term payment option specif industri company??? need provid follow industry-specif small busi fund solut ??? auto repair shop loan ??? gas station loan ??? day care center fund ??? medic practic loan ??? chiropract busi loan ??? dental practic loan ??? physician practic loan ??? veterinari practic financ ??? health care busi loan ??? hotel motel financ ??? restaur loan ??? pharmaci loan ??? law firm financ ??? insur agenc financ ??? vineyard breweri financ ??? liquor store financ ??? funer home financ ??? self-storag financ whether need busi expans loan cash flow financ work capit loan fundat small busi financ solut help compani achiev goal also offer inventori loan help keep busi fulli stock refin loan help repay exist loan acquir better term interest rate matter use altern busi loan fundat expect support throughout entir small busi financ process custom relationship manag work close understand uniqu situat find best fund solut compani continu support long run reach goal contact fundat inform appli small busi loan today,Term loans,Working Capital ,37.3134328358209
70,e-commerc marketplac real estat e-commerc marketplac real estat assetavenu onlin lender real estat invest properti assetavenu los angeles-bas onlin lender use technolog improv way peopl borrow money real estat invest properti innov onlin platform proprietari data model enabl us deliv new benchmark speed transpar flexibl tradit bank ca n't compet fund loan institut capit matter day assetavenu back world 's lead vc firm includ dcm ventur matrix partner neteas capit name one top 10 lend start-up watch 2014 featur numer public includ wall street journal entrepreneur inc forb,Term loans,Term loans,37.3134328358209
199,financ financi servic fintech lend financ financi servic fintech lend lendio platform help small busi owner find lender secur loan lendio oper onlin marketplac enabl small busi owner find lender secur loan fill applic form platform match custom suitabl loan option work network 50 lender enabl user compar choos among rang loan includ sba startup equip commerci real estat also offer loan calcul inform blog educ resourc launch march 2006 lendio base south jordan utah,Term loans,Lead generation platform,37.3134328358209
0,financ onlin auction small medium busi financ onlin auction small medium busi livecapit provid onlin small busi financ livecapit offer onlin busi financ servic offer user servic decisionexpress product creat econom benefit autom credit leas decis process integr workflow technolog consult solut enabl enterpris make credit decis improv product achiev sale provid credit custom livecapit u.s.-bas compani found 1996 compani acquir dun bradstreet credibl corpor juli 27 2005,Term loans,Term loans,37.3134328358209
90,financi servic internet lend financi servic internet lend small busi owner 's best friend fundera place small busi owner go need fund grow busi free easi fast honest industri known opposit fundera strive break mold univers applic marketplac model let busi owner skip ???feel lost??? moment focus realli matters?? ? build busi one simpl applic small busi owner appli industry??? lead lender let compar rate across differ kind loan re alway hire intellig invest passion peopl join team check us fundera.com/job,Lead generation platform,Working Capital ,37.3134328358209
64,financi servic financi servic even financi suppli side platform ssp marketplac lend base new york citi even financi suppli side platform fast grow marketplac lend p2p market initi mission bring better qualiti borrow marketplac lend ecosystem believ strong loan product everyon marketplac lend grow better data help lender see borrow credit score,Lead generation platform,Lead generation platform,37.3134328358209
310,bankbazaar world 's first neutral onlin marketplac instant customis rate quot loan credit card,Lead generation platform,Personal loans,37.3134328358209
219,credit financi servic fintech credit financi servic fintech mortgag get whole lot easier hi re maxwel we???r mission revolution 8.5t residenti mortgag market reimagin loan offic work togeth homebuy real estat agent buy home connect network one seamless intuitively-design platform focus isn???t paperwork it??? place call home,Lead generation platform,Others,37.3134328358209
52,"financi servic internet marketplac financi servic internet marketplac biz2credit hub connect small busi owner lender servic provid seek solut base onlin profil biz2credit www.biz2credit.com connect small busi owner lender servic provid thus empow effect compet big compani enhanc servic product grow enterpris biz2credit match small busi credit solut base onlin profil complet less five minut safe effici price-transpar environ biz2credit network consist 50,000 user 300 lender credit rate agenc equifax broker includ bizbuysel major small busi servic provid hp biz2credit top financ resourc entrepreneur magazin 2009 compani process 3,000 loan applic month facilit 400 million fund sinc 2007 registr free howev biz2credit also offer vari level subscript servic includ phone support case manag assist borrow entir lend process start initi applic form end day loan close biz2credit recent introduc free bizanalyzer??????? app android http //bit.ly/hlmwbl use inform credit rate agenc dun bradstreet bizanalyz provid free financi check-up small busi owner make loan applic process effici enabl borrow download review credit score tool benchmark risk assess small busi owner lend criteria 300 financi institut risk profil industri peer factor credit rate ultim impact credit decis lender biz2credit suggest best loan option possibl",Lead generation platform,Working Capital ,37.3134328358209
118,"e-commerc energi power grid e-commerc energi power grid found 2001 purchas power offer becom one countri 's premier purchas program employe found 2001 purchas power offer becom one countri 's premier purchas program employe atlanta-bas compani tap `` fastest-grow '' list sever lead busi public includ entrepreneur inc. magazin date purchas power servic 400,000 order employe lead compani organ across u.s. fortun 500 govern agenc",Purchase Financing ,Working Capital ,37.3134328358209
130,internet internet finomena financi technolog start-up revolutionis way everi consum think finance. innov happen smart peopl stubbor decid ask simpl first-principles-bas question instead accept status-quo-bas answer found stanford iit delhi graduat ve previous kick ass place like facebook microsoft boston consult group bain capit finomena provid access flexibl credit larg segment india??? young demograph tradit access finomena aim radic chang end-to-end custom experi borrow person profession growth make young indian financi independ financi liter thus revolutionis way bank done today??? smartphone-wield indian,Purchase Financing ,Personal loans,37.3134328358209
4,e-commerc onlin portal shop e-commerc onlin portal shop affordit.com site enabl custom purchas product week payment basi affordit site allow custom purchas product financ week payment custom purchas product sing debit credit card account payment deduct consecut week payment also deduct,Purchase Financing ,Purchase Financing ,37.3134328358209
158,custom servic onlin portal payment custom servic onlin portal payment buy pay later solut india epaylat found decemb 2015 aurko bhattacharya prasannaa murlidharan uday somayajula shanmunathan thiagaraja saxena compani give custom option ???buy pay later??? onlin portal one click custom get 14 day make payment within period make mani transact via single-click checkout bunch togeth make singl payment end period,Purchase Financing ,Purchase Financing ,37.3134328358209
43,app big data mobil app big data mobil pier instant painless consum financ checkout us chines consum pier financi technolog compani focus develop technolog solut enabl custom transact mobil phone offer servic unit state china pier offer applic enabl custom access servic pier headquart san francisco offic shanghai china found richard jia juli 2014,Purchase Financing ,Others,37.3134328358209
232,financi servic financi servic tempo found 2009 one man employe spent countless hour creat new way peopl take merchandis tempo found 2009 one man employe spent countless hour creat new way peopl take merchandis home simpl approv process credit requir tempo grown home basement oper multi-offic nation provid credit requir shop sever payment option,Purchase Financing ,Purchase Financing ,37.3134328358209
287,financi servic financi servic loantap fintech compani dna constitu loantap onlin platform commit deliv flexibl loan product salari profession innov otherwis dull loan segment deliv smart product millenni idea use technolog build flexibl product without ad cost,Working Capital ,Personal loans,37.3134328358209
50,internet softwar internet softwar data driven inventori financ hardwar compani kickpay transform hardwar compani financ inventori leverag client 's data kickpay enabl access financ previous unavail allow grow faster,Working Capital ,Others,37.3134328358209
229,lend small medium busi lend small medium busi loan frame aim revolutionis small busi lend subcontin cut edg technolog autom loan frame fintech compani ambit meet abil build largest sme lend marketplac sub-contin back lead global privat equiti ventur capit investor help build icon compani world re-imagin small busi lend merg world-class process lead global bank deep indian sme credit experi data scienc cut edg proprietari technolog laser focus help small busi grow,Working Capital ,Term loans,37.3134328358209
81,"financ financi servic financ financi servic lsq lead invoic financ platform u.s. access 5,000 50 million work capit click button lsq lead invoic financ platform u.s. give entrepreneur power access 5,000 50 million afford work capit click button platform busi upload unpaid invoic get money instant without wait 30 60 90 day get paid custom free cash trap open invoic busi owner get financ need grow keep move forward without take loan found 1996 we???v deliv 10 billion fund thousand busi across nation we???r profit expand rapid orlando hq new york san francisco offic recent rais 110 million ventur capit",Working Capital ,Working Capital ,37.3134328358209
106,fintech fintech digit platform let small retail emerg market financ consum good enabl mobil cashless payment,Working Capital ,Purchase Financing ,37.3134328358209
189,digit media financ fintech digit media financ fintech fastpay definit financi platform digit media found 2009 offic los angel new york london fastpay provid liquid financi workflow solut global media industri sinc incept fastpay origin 1 billion loan publish network exchang dsps ssps agenc app develop,Working Capital ,Term loans,37.3134328358209
146,crowdfund financ financi servic crowdfund financ financi servic startwis crowdfund platform make revenu share invest access everyon startwis make revenu share invest deal access everyon startwis revenu share marketplac everyon regardless incom invest expertis becom investor compani care start 100 model simpl invest 100 deal compani pay fix revenu everi 3 month reach maximum payout rang 110 250 depend deal term empow peopl bank invest made simpl,Working Capital ,Lead generation platform,37.3134328358209
107,financi servic fintech lend small medium busi financi servic fintech lend small medium busi quick provid work capit small busi exclus partnership saas/po platform quick provid capital-as-a-servic offer saa ecommerc marketplac payment platform therebi make easi seamless merchant platform appli receiv cash advanc quick quick 's intuit widget enabl small busi owner appli receiv work capit `` quick '',Working Capital ,Working Capital ,37.3134328358209
99,financi servic fintech small medium busi financi servic fintech small medium busi ecg provid loan small busi u.s. histor underserv tradit financi institut expans capit group llc ???ecg??? provid loan small busi u.s. histor underserv tradit financi institut may experienc challeng obtain afford time financ compani develop technolog platform use predict model data aggreg electron payment technolog enabl servic target market tradit lender general focus small busi owners??? person credit histori ecg focus small busi owners??? person credit histori also perform small busi use broad array tradit nontradit data sourc compani develop proprietari end-to-end lend platform includ onlin base origin platform proprietari credit score model autom collect platform collect ach payment merchant,Working Capital ,Term loans,37.3134328358209
25,educ financ lend educ financ lend p2p educ microfin lender vittana make possibl young peopl around world get student loan direct lender like vittana envis world student anywher get student loan attend communiti colleg vocat school colleg 1 thing famili around world want one common univers desir peopl throughout world give children better chanc life make loan vittana re realli two thing yes re enabl student get degre get job immedi giant step toward better life re also someth even bigger re prove world educ matter student loan work one student one loan one job time vittana work background facilit loan make direct student also work forefront global movement bring student loan young peopl throughout world,Others,Others,37.3134328358209
207,analyt big data credit analyt big data credit ximu credit util big data understand consum credit worthi ximu credit util big data understand consum credit worthi help make loan decis base risk analysi price model,Others,Others,37.3134328358209
351,financi servic inform technolog lend financi servic inform technolog lend shubhloan help financi servic provid access serv new underserv market segment datasign disrupt technolog compani forg idea use tradit non-tradit data comput peopl 's credit score aim democrat credit million borrow part formal credit system help financi servic provid access serv new underserv market segment deliv risk- as- -servic raa mobil platform shubh loan,Others,Personal loans,37.3134328358209
239,"big data credit financi servic inform technolog mobil softwar big data credit financi servic inform technolog mobil softwar tala mobil technolog data scienc compani revolution financi servic emerg market tala innov fast-pac mobil technolog start-up provid credit score report platform financi servic institut emerg countri tradit credit n't work emerg market mobil technolog unlock trillion dollar purchas power world??? fastest grow economi tala mobil technolog data scienc compani flip tradit credit score model put power hand newli empow consum emerg market mobil app uniqu channel gather averag 10,000 discret data point per user provid person offer deliv real-tim credit",Others,Others,37.3134328358209
172,educ lend educ lend fund u prefer no-cosign fafsa non-fico base student lender hardwork career focus colleg student fund univers fund univers privat student lender serv hardwork career driven undergradu parent lender depend fico score cosign fund univers assess student??? credit worthi base career track amp post-colleg earn potenti fund u take applic waitlist next school year fund expand avail lend student nationwid learn visit? www.funding-university.com visit funding-university.com,Others,Personal loans,37.3134328358209
303,bank financi servic fintech softwar bank financi servic fintech softwar insikt reinvent world fintech revolutionari platform enabl brand lend custom lend servic insikt sprung realize brand bank lender tomorrow tradit bank littl interest make small person loan n't kept fast-pac world technolog unequip har power data evolv world financ insikt 's uniqu data driven technolog combin notabl stride fintech reinvent world lend bring credit opportun mass social media technolog creat new relationship consum tomorrow??? lender media giant retail everyday brand offer custom path financi mainstream believ remark platform handl score servic technolog capit futur lend ???lend servic '' describ process put power provid fair price credit-build person loan direct hand brand seek deepen bond custom stay tune re get start,Others,Personal loans,37.3134328358209
76,"crowdfund educ enterpris softwar financ crowdfund educ enterpris softwar financ india 's largest crowdfund platform milaap india 's lead crowdfund platform person social caus rais money person caus emerg love one neighbourhood project social caus 12 million rais 50,000+ project across india",Others,Others,37.3134328358209
290,automot financ mobil automot financ mobil autogravity??? uniqu mobil platform deliv auto financ palm hand autograv fintech pioneer mission transform process financ car uniqu digit experi autograv partner world??? lead bank give consum direct control financ car smartphon offer simpl mobil platform autograv empow custom multipl loan offer network trust car dealerships.? headquart irvin ca autograv found team digit nativ industri veterans.? learn visit www.autogravity.com follow autogravityhq twitter,Others,Others,37.3134328358209
313,financi servic inform technolog payment financi servic inform technolog payment carecap cloud-bas payment manag system enabl busi provid custom easi custom autom payment plan grow number consum lack abil pay in-ful need good servic point purchas carecap cloud-bas payment manag system enabl busi provid custom easi custom autom way pay time -- e-invo -- subscript -- payment plan,Others,Term loans,37.3134328358209
165,fintech machin learn risk manag saa share economi fintech machin learn risk manag saa share economi trooli deliv instant trust??? servic verifi screen predict trustworthi relationship interact fintech p2p trooli deliv instant trust??? servic verifi screen predict trustworthi relationship interact work world??? largest financi institut peer-to-p marketplac market employ instant trust rate servic design fill ???trust gap??? caus speed modern commerc communiti requir instant evalu potenti reward risk ?? ? without trust-build interact histori feedback loop peopl use evalu relationship offlin machin learn technolog synthes digit footprint real time provid rich insight ?? ? well beyond old-school background check credit score risk manag tool instant trust rate requir minim custom data input cost less 1 per queri rate support evid return rough 30 second trooly??? predict power demonstr least twice effect background check credit check databas profil determin trustworthi individu busi trooli oper consum report agenc use public permiss inform onlin offlin sourc respect compli applic privaci data protect law includ fair credit report act unit state also dedic balanc transpar respect individu privaci,Others,Personal loans,37.3134328358209
231,consum lend credit financ consum lend credit financ credibl multi-lend marketplac allow borrow receiv competit loan offer vet lender credible??? found principl provid borrow level transpar deserv multi-lend marketplac allow borrow receiv competit loan offer vet lender credibl empow consum take control student loan borrow fill one form receiv compar person offer numer lender choos best serv individu need credibl fierc independ commit deliv fair unbias solut student lend,Others,Others,37.3134328358209
336,milaap india 's number one crowdfund platform websit india fundrais crowdfund india simplifi,Others,Term loans,37.3134328358209
89,financ financ rateg onlin mortgag marketplac borrow bank set rate will pay home loan rateg lead mortgag marketplac mobil web user easili connect reput lender meet need negoti lowest possibl interest rate rateg bid platform,Others,Others,37.3134328358209
363,chariti chariti graduat generat beyond poverti graduat generat beyond poverti,Others,Personal loans,37.3134328358209
