,Test_document,Expected_result,decision_model_6,decision_model_6_accuracy
256,credit financ financi servic fintech credit financ financi servic fintech colleg ave student loan product made firstrust bank member fdic colleg ave student loan offer privat student loan undergradu student graduat student parent student enter colleg special student loan abl provid custom attent deserv deliv loan person individu compani also facilit competit rate repay option customer-friend experi applic repay colleg ave student loan also offer borrow choic defer interest flat payment full princip interest payment,Others,Purchase Financing ,37.3134328358209
174,educ financ financi servic internet educ financ financi servic internet commonbond onlin lend platform connect borrow investor make educ financ better commonbond found lower cost higher educ innov model make possibl student save money student loan allow investor earn competit financi return,Others,Others,37.3134328358209
208,big data databas financi servic big data databas financi servic quantgroup financi big data compani,Others,Others,37.3134328358209
255,consum lend credit financ fintech lend person financ consum lend credit financ fintech lend person financ lend club onlin financi communiti bring togeth creditworthi borrow savvi investor lend club onlin financi communiti bring togeth creditworthi borrow savvi investor benefit financi replac high cost complex bank lend faster smarter way borrow invest,Personal loans,Lead generation platform,37.3134328358209
271,financi servic fintech inform technolog financi servic fintech inform technolog paysens fintech startup focus bring innov financi servic indian consum paysens fintech startup focus bring innov financi servic indian consum,Personal loans,Others,37.3134328358209
163,financi servic fintech payment person financ financi servic fintech payment person financ payoff make loan help peopl pay credit card debt payoff financi well compani provid member person loan develop product servic support member attain target focus connect financi behavior person compani partner first electron bank origin loan client payoff use 256-bit encrypt protect clients??? inform bank account number social secur number parti offer fix loan rate loan amount client charg one-tim origin fee servic,Personal loans,Purchase Financing ,37.3134328358209
83,financ financi servic impact invest financ financi servic impact invest circleback lend internet-bas credit platform purchas fix incom asset back consum credit product circleback lend internet-bas consum lend platform two-part mission first aim provid prime super-prim consum unit state fast effici way borrow money attract interest rate second offer institut high-net-worth individu investor robust transpar platform invest consum loan internet alreadi becom primari place individu manag person financ circleback lend believ trend continu especi tradit bank lend institut maintain extrem tight credit polici even credit-worthi borrow also believ profession investor continu deploy capit consum credit diversifi portfolio beyond tradit stock bond,Personal loans,Lead generation platform,37.3134328358209
249,credit financi servic fintech credit financi servic fintech lend street lend platform debt restructur refinanc lendstreet mission simpl help peopl get debt rebuild credit get fresh start partnership within financi sector allow negoti discount debt mean pass discount custom turn get debt sooner rebuild credit get live,Personal loans,Others,37.3134328358209
251,financi servic financi servic time emi payment squar month bill make major purchas desir cash fin-tech product tslc pte ltd. uniqu young profession serv smart digit world cash offer millenni quick easi person loan process transpar innov tune time cash util sophist algorithm machin learn capabl deliv amaz improv lend experi custom therebi help young profession achiev financi goal effortless app offer instant transfer fund approv applic,Personal loans,Purchase Financing ,37.3134328358209
292,fintech internet person financ fintech internet person financ self lender help peopl build credit simpl save plan self lender help thousand peopl begin financi journey credit builder account understand build financi foundat daunt task peopl re dedic build product help custom move two step right direct,Personal loans,Personal loans,37.3134328358209
93,consum lend financ financi servic fintech lend consum lend financ financi servic fintech lend chang way borrow safer faster better financi product avant oper onlin marketplac provid user access person loan consolid debt pay unexpect medic expens famili vacat use big data machine-learn algorithm compani offer custom approach streamlin credit option compani cater consum unit state unit kingdom headquart chicago illinoi avant found novemb 2012,Personal loans,Personal loans,37.3134328358209
288,financ fintech lend financ fintech lend lendup social respons lender 56 american shut mainstream bank due low credit volatil incom lendup??? mission provid anyon path better financi health build technolog credit product educ experi 56 us popul shut mainstream bank poor credit volatil incom technolog built in-hous current offer sever type credit product includ loan credit card emb educ product avail credit build opportun help borrow improv long-term financi health break vicious debt cycl found two step-broth ceo sasha orloff cto jake rosenberg sasha put ???fin??? fintech work citi world bank grameen bank jake put ???tech??? fintech platform cto zynga 29 began work yahoo age 16 employe 80,Personal loans,Purchase Financing ,37.3134328358209
212,bank financi servic lend bank financi servic lend faircent.com websit borrow lender connect direct faircent help elimin high margin intermediari like bank financi institut make transact bank massiv overhead thousand employe pay hundr branch maintain bank must take larg margin money pass wherea faircent.com peopl spare money lend direct peopl want borrow bank middl huge overhead,Personal loans,Personal loans,37.3134328358209
224,fit health care well fit health care well letsmd.com marketplac elect surgeri letsmd hope chang way peopl access healthcar india price transpar healthcar price india black hole aim provid avenu prospect patient connect ethic healthcar servic provid offer transpar price found advis peopl decad experi healthcar letsmd aim go destin peopl seek high qualiti healthcar afford price,Personal loans,Term loans,37.3134328358209
365,crowdfund financ financi servic crowdfund financ financi servic crowdfund loan back peopl believ wefin let borrow creat loan list describ borrow need word help market list potenti lender save includ regular peopl network pledg take minut handl transact direct addit work rememb repay borrow save money lender get good return low risk side feel great help peopl network save money,Personal loans,Term loans,37.3134328358209
155,financi servic lend payment financi servic lend payment china-bas p2p lend platform weidai earli stage person credit system base china peer-to-p lend servic use vehicl collater weidai plan expand use properti collater provid person loan well,Personal loans,Working Capital ,37.3134328358209
57,consum lend financ financi servic consum lend financ financi servic creditshop offer afford onlin loan simpl payment plan mani borrow find unsecur person loan reason interest rate extrem difficult often borrow forc consid lender charg high interest rate hefti fee request valuabl item collater creditshop consum qualifi interest rate rang 18 30 creditshop custom make month payment time never pay ongo transact fee late fee annual fee prepay fee reason creditshop loan might smart choic cost less mani consum,Personal loans,Personal loans,37.3134328358209
259,unlock home equiti wealth consum without interest month payment,Personal loans,Purchase Financing ,37.3134328358209
312,instant approv onlin payday loan servic canada canada-payday-loan fastest grow onlin payday loan firm canada.w complet understand financi need determin serv best.canada-payday-loan offer hassl free onlin payday loan servic charg fees.your loan approv responsibility.open 24 hour,Personal loans,Personal loans,37.3134328358209
54,consum e-commerc search engin consum e-commerc search engin taodangpu e-commerc websit focus abandon pawn item pawnshop taodangpu ????? ? ? ? ? e-commerc websit focus abandon pawn item pawnshop help pawnshop display item make conveni consum understand search purchas item taodangpu subordin shanghai jade diamond e-commerc,0,Others,37.3134328358209
