,Test_document,Expected_result,knn_model_3,knn_model_3_accuracy
146,crowdfund financ financi servic crowdfund financ financi servic startwis crowdfund platform make revenu share invest access everyon startwis make revenu share invest deal access everyon startwis revenu share marketplac everyon regardless incom invest expertis becom investor compani care start 100 model simpl invest 100 deal compani pay fix revenu everi 3 month reach maximum payout rang 110 250 depend deal term empow peopl bank invest made simpl,Others,Others,77.02702702702703
114,credit financ financi servic credit financ financi servic qredit abl provid small loan dutch sme compani qredit helpt startend en bestaand ondernem bij het succesvol door starten van hun bedrijf dit doen door het aanbieden van ondernemerstool persoonlijk coach ??n het verstrekken van bedrijfskredieten tot ???250.000 on doel om dromen van ondernem mogelijk te maken vertrouwend op de kracht van het ondernemerschap de kracht van een go ide daarbij kijken wij liever naar de toekomst dan naar het verleden,Others,Others,77.02702702702703
342,ovamba platform util peer-to-p lend model allow retail institut lender lend borrow loan ovamba platform use social ???peer-to-peer??? lend model allow retail institut lender lend borrow complet transpar ovamba platform provid liquid risk manag regul local financi firm reduc cost complex usual seen tradit bank system pass save onto ovamba??? member borrow,Others,Others,77.02702702702703
106,fintech fintech digit platform let small retail emerg market financ consum good enabl mobil cashless payment,Others,Others,77.02702702702703
10,payment payment lendfriend offer softwar product provid support user loan??? creation propos approv repay lendfriend fintech startup focus undeserv lend market team built 3 product onlin p2p lend platform target friend famili grew 3mm+ loan multipl underwrit model util proprietari data tradit brick mortar high-interest lender identifi custom profil target larger loan lower interest rate loan repay disproport credit score onlin platform match high-risk borrow aggreg network onlin lender place loan prepaid card product 's purpos bank underbank lendfriend part ** angelpad http //angelpad.org 3** 2011,Others,Education Loans ,77.02702702702703
310,bankbazaar world 's first neutral onlin marketplac instant customis rate quot loan credit card,Others,Others,77.02702702702703
39,fintech fintech first-ev student loan comparison tool achievelend first-ev student loan comparison tool achievelending.com offer user free onlin portal search find compar student loan design help tradit non-tradit student find best student loan achiev lend first tool kind aggreg loan offer seek privat financ educ purpos take 30 second find choos best loan avail learn www.achievelending.com becom achiev lend affili commiss junction http //bit.ly/1ylqddi,Others,Education Loans ,77.02702702702703
92,busi develop financi servic fintech lend marketplac busi develop financi servic fintech lend marketplac driverup first onlin auto lend marketplac accredit investor driverup onlin marketplac offer automot financ servic platform util proprietari technolog creat direct-to-investor option user integr softwar advanc data analyt marketplac enabl effici process direct invest auto loan full transpar report also first mechan offer accredit investor hedg fund famili offic high net-worth individu opportun particip direct high-yield auto lend launch 2012 marketplac oper dalla texa,Auto Loans ,Others,77.02702702702703
89,financ financ rateg onlin mortgag marketplac borrow bank set rate will pay home loan rateg lead mortgag marketplac mobil web user easili connect reput lender meet need negoti lowest possibl interest rate rateg bid platform,Mortgages,Others,77.02702702702703
324,financ financi servic person financ financ financi servic person financ guarante rate provid mortgag lend servic home loan home mortgag refinanc servic,Mortgages,Others,77.02702702702703
334,financi servic micro lend financi servic micro lend microenergi credit social enterpris provid consum develop countri clean energi product microenergi credit social enterpris provid consum develop countri clean energi product help microfin institut start clean energi lend program strengthen cloud-bas technolog last-mil servic scale carbon financ company??? product includ heat cook stove solar led light product solar home system water purif system clean household packag includ solar light effici stove water filter exact product specif packag vari local depend market research custom feedback given locat packag design local afford enough consum pay back microloan within 8 month microenergi credit co-found jame dailey https //www.crunchbase.com/person/james-dailey-2 april allderdic https //www.crunchbase.com/person/april-allderdic 2007 base seattl washington,Mortgages,Mortgages,77.02702702702703
7,financ fintech real estat financ fintech real estat financi real estat consum websit base santa ana california busi sinc 2006 icanbuy provid accur real-tim mortgag loan rate comparison instant consum base uniqu financi credit profil icanbuy???????? disrupt technolog platform develop cut confus mortgag market inform empow homebuy make sound financi decis find lowest mortgag rate unlik tradit mortgag comparison site simpli captur consum inform without provid mortgag rate inform icanbuy provid consum depth loan rate inform allow consum compar lender loan product select lender want work learn www.icanbuy.com,Mortgages,Others,77.02702702702703
337,consum point sale softwar consum point sale softwar mortgagebot h provid financi institut softwar facilit mortgag applic process mortgagebot llc industry-lead inc. 500 compani provid uniqu award-win mortgagebot powersite?? regist famili integr point-of-sal ipo solut take mortgag applic everi mortgag channel consumer-direct via internet branch call center profession loan offic mortgagebot blend extens mortgag experi leading-edg ?????? ? software-as-a-service??????? saa technolog creat scaleabl afford web site 900 mortgag lender nationwid,Loan management platform,Loan management platform,77.02702702702703
45,financ publish ventur capit financ publish ventur capit open book ben altern tradit busi credit bureau open book ben altern tradit busi credit bureau build on-lin communiti small medium-s busi `` '' smbs '' '' collabor share creditworthi busi intellig system beta sever financi institut compani use feedback ben democrat access creditworthi type import busi data smbs struggl near everi aspect busi credit exist credit bureaus often fail score smbs accur small firm even show databas sinc afford solut busi credit data smbs suffer huge write off 64 billion last year ben solut problem discuss platform attract altern credit bureaus ben also offer power market lead gen tool also offer greatly-need smb suppli chain tool `` '' vendor worth '' '' score help smbs assess qualiti b2b vendor,Credit rating platforms,Others,77.02702702702703
239,"big data credit financi servic inform technolog mobil softwar big data credit financi servic inform technolog mobil softwar tala mobil technolog data scienc compani revolution financi servic emerg market tala innov fast-pac mobil technolog start-up provid credit score report platform financi servic institut emerg countri tradit credit n't work emerg market mobil technolog unlock trillion dollar purchas power world??? fastest grow economi tala mobil technolog data scienc compani flip tradit credit score model put power hand newli empow consum emerg market mobil app uniqu channel gather averag 10,000 discret data point per user provid person offer deliv real-tim credit",Credit rating platforms,Credit rating platforms,77.02702702702703
283,financ fintech financ fintech cignifi data monet startup develop analyt platform deliv credit market score use mobil behavior data cignifi revolution way financi servic compani meet need 2.7 billion peopl worldwid mobil phone access formal financi servic compani develop first proven analyt platform deliv credit market score consum use mobil phone behavior data,Credit rating platforms,Credit rating platforms,77.02702702702703
15,analyt predict analyt servic industri analyt predict analyt servic industri l2c nation 's lead provid advanc consum score analyt solut l2c nation 's lead provid advanc consum score analyt solut l2c leverag altern payment asset data creat new predict credit collect market score 260 million american l2c????????s client includ lead institut financi servic retail healthcar automot telecommun media entertain industri,Credit rating platforms,Credit rating platforms,77.02702702702703
278,credit financ financi servic credit financ financi servic adf purpose-built optim link underestim underbank consum capit market adf purpose-built optim link underestim underbank consum capit market,Credit rating platforms,Others,77.02702702702703
171,consum applic educ consum applic educ gyandhan educ loan marketplac gyandhan we???r mission ensur financi obstacl never stand way someone??? educ dream combin data scienc financi innov provid afford educ loan option indian student pursu higher studi,Education Loans ,Education Loans ,77.02702702702703
356,sofi entrepreneur program brilliant busi idea opportun grow someth special,Education Loans ,Others,77.02702702702703
124,fintech person financ fintech person financ offer student loan employ benefit student loan genius help compani reach next level recruit retent student loan genius work improv financi outlook employe student loan empow compani help employe reduc student loan debt company??? fix pay match approach simplifi complex problem associ student loan debt reconnect employ employe help busi grow employe retent recruit offer person advic help employe design custom plan meet goal handl payment payrol implement strategi pay loan provid match contribut toward employees??? student loan student loan genius establish 2013,Education Loans ,Education Loans ,77.02702702702703
250,credit educ fintech credit educ fintech climb new kind lend compani strive work school consist improv live student climb credit financ educ work identifi school consist improv graduat earn potenti justifi cost tuition provid simpl fast afford loan student help meet career financi goal know student credit score factor power transform educ climb offer student better rate -- strive financ educ posit impact student live,Education Loans ,Education Loans ,77.02702702702703
136,app financi servic app financi servic branch new way access credit smartphon emerg market branch elimin challeng get loan use data phone creat credit score encrypt data choos share us protect privaci share inform third parti,Micro Finance ,Others,77.02702702702703
